Attendance,Attendance Status,Bonus,Date,Director,Email,Gender,Job Level,Month,Name,Please enter your feedback,Please enter your score,Please select your location,Quarter,Salary,Senior Manager,Team,Training
Present,99,4061.87,2025-01-07,James Johnson,tamaraedwards@gmail.com,Male,Lead,December,Christina Wang,Direction trip serve politics mean evening same day account.,2,Tokyo,Q3,99395.66,Andre Miller,Development,Pending
Absent,58,2266.0,2025-04-21,Jeffery Carney,david24@olson.info,Other,Senior,December,Phillip Hunt,Court agree usually political mind modern event west before officer mouth weight thank.,7,Sydney,Q1,58771.63,Mark Smith,Support,Completed
Absent,66,4984.66,2025-05-05,Shawn Haas,tyronemcdaniel@gutierrez-bradley.biz,Female,Mid,August,Jonathan Olson,Three low energy third effort wear a high series treat add west.,1,New York,Q2,98860.53,Scott Wright,HR,Pending
Present,75,4690.13,2025-02-06,Karen Mcguire,robinsonluis@orozco.com,Female,Mid,January,Gary Powell,Together night four first both think book wall day especially among wear.,1,Mumbai,Q2,99636.97,Randy Ortega,Development,In Progress
Absent,28,3535.2,2025-02-09,Lance Jones,christopher23@pham-sanchez.com,Female,Lead,March,Kathryn Hampton,Modern free point side military executive least week beyond current.,7,Tokyo,Q4,42112.66,Emily Johnson,Marketing,Completed
Present,44,3245.96,2025-04-06,Ray Chapman,meganpark@stark.biz,Female,Lead,May,Jerry Burgess,Capital indicate off eat spend challenge end sort us decision audience building beautiful.,1,New York,Q2,31801.56,Amanda Gibbs,HR,Pending
Present,45,4440.94,2025-03-06,Katherine Johnson,dwashington@snow.com,Other,Senior,January,John Ford,Capital world grow whatever challenge wish.,8,New York,Q1,60004.07,Dr. Christopher Bautista,HR,Completed
Absent,49,4783.49,2025-02-06,Stephanie Gonzalez,jnolan@mccoy.info,Male,Senior,December,Sarah Fuller,Quality see same say event wall girl brother.,6,Mumbai,Q2,43908.76,Jesus Perkins,Development,Completed
Present,18,4735.65,2025-03-31,Robert Salazar,matthewgonzales@yahoo.com,Female,Junior,April,James Hamilton,Fact stop heavy property federal dinner would president unit these bed.,6,Tokyo,Q1,116637.33,Jasmin Frazier,Support,Completed
Present,94,1447.91,2025-03-21,Madeline Heath,jamesglenn@hotmail.com,Male,Mid,August,Sarah Lynch,Interview mother should white under value campaign knowledge.,10,Sydney,Q2,104007.99,Kristi Summers,HR,Pending
Present,42,3753.61,2025-02-11,Lori Hamilton,nnelson@hotmail.com,Other,Lead,March,Joseph Reed,Fish form system so eye method factor character any.,4,London,Q1,72394.77,Samuel Conley,HR,Pending
Absent,19,4613.48,2025-03-17,Sydney Noble,kimberly89@newman-long.com,Female,Mid,November,David Lawson,Attorney drive center today dog member ok arrive mean social finish.,8,Mumbai,Q3,98683.2,Wendy Wu,Development,In Progress
Present,47,4905.58,2025-04-06,Ryan Duncan,hinesjoshua@olsen-clark.com,Female,Senior,April,Sylvia Mosley,Color minute society memory ground community allow design have even.,7,Tokyo,Q2,61766.86,Lynn Goodman,Support,Pending
Absent,35,3669.09,2025-01-11,Mrs. Emily Allen MD,kerrjason@cervantes.biz,Other,Senior,March,Mary Hamilton,Authority manager authority owner need data.,6,Tokyo,Q4,60489.46,Alexis Andersen,Sales,Completed
Absent,51,4048.46,2025-03-28,Jennifer Quinn DVM,ygarza@pierce-meyer.info,Female,Lead,February,Lisa Moore,Fall road I address than serious marriage might each send.,5,London,Q1,89952.79,William Brown,Marketing,In Progress
Absent,20,2312.43,2025-03-15,Mr. Donald Smith,thomasandrew@gmail.com,Other,Lead,June,Robert Bell,Stock sit east himself enjoy law.,10,Mumbai,Q3,49095.89,Gary Johnson,HR,Completed
Present,84,3072.58,2025-03-07,Carl Brown,loricunningham@weaver.net,Female,Lead,November,John Brown,Certain government sell past break southern thus main speak reach yourself.,9,Mumbai,Q1,65222.05,Jacob Atkinson,HR,In Progress
Present,61,1490.59,2025-03-08,Robert Allen,shunter@davies.biz,Male,Senior,June,Mr. Thomas Mason,Condition thought fly visit letter ten example break.,5,Sydney,Q2,36655.87,Tonya Moreno,Development,In Progress
Absent,86,4986.9,2025-03-28,Dakota Rodriguez,davidcarr@wood.biz,Female,Senior,September,Krista Mosley,Party carry health weight window right generation statement.,7,Sydney,Q3,104545.77,Sarah Sanford,Development,In Progress
Absent,99,4427.43,2025-04-12,Carmen Molina,heatherking@yahoo.com,Other,Junior,June,Jenna Love,View smile team challenge long though.,8,New York,Q1,54386.32,Joseph Reid,Marketing,In Progress
Absent,24,2739.12,2025-02-20,Joseph Wright,christina16@brooks-thomas.com,Female,Junior,April,Bruce Ball,Little course suffer bit perform leg value every.,2,London,Q3,100056.48,Dr. Todd Williams,Development,Completed
Absent,15,1866.72,2025-03-19,Martin Griffin,holmeschase@yahoo.com,Female,Senior,April,Angel Dyer,Ago address deal cultural rock development office person natural seat doctor sure.,4,Mumbai,Q3,33323.51,Scott Rivera,Support,Pending
Present,95,4264.26,2025-04-05,Ernest Hayes,frederickgross@gmail.com,Other,Mid,July,Cynthia Armstrong,And friend simply here study forward choice along region.,5,London,Q3,105517.48,Lee Jensen,HR,Completed
Present,99,3401.55,2025-05-10,Catherine Gonzalez,cannonjeremy@hotmail.com,Female,Junior,January,Amber Willis,Tree nearly actually consumer ball camera hot number themselves break degree table.,3,London,Q2,41422.4,Megan Haas,Marketing,Completed
Present,2,4130.57,2025-01-25,Jennifer Evans,michellerodriguez@yahoo.com,Male,Junior,June,Amber Stout,Move central attention everybody design least lose space avoid.,8,Sydney,Q3,50259.56,Tracy Friedman,Marketing,In Progress
Absent,85,4403.86,2025-04-25,Peggy Christensen,brittney15@hotmail.com,Other,Lead,April,Melanie Grant,System manage either voice front stage address.,3,Sydney,Q1,112513.43,Tyler Lee,Development,Pending
Present,57,2276.01,2025-03-10,David Smith,eallen@yahoo.com,Male,Junior,October,Brooke Nguyen,Most out small business rest never part.,2,Sydney,Q2,52785.68,Donna Nelson,HR,In Progress
Absent,34,2942.87,2025-02-19,Joshua Miller,kyleaustin@cameron-landry.com,Female,Senior,September,Paul Snyder,Machine establish we black institution model.,10,Sydney,Q4,37365.93,Kelsey Joseph,Sales,In Progress
Present,3,4266.74,2025-01-09,Thomas Garcia,gregorydelgado@hotmail.com,Male,Senior,September,Jennifer West,Most consumer discuss moment single simply will people.,8,Tokyo,Q3,48102.0,Stephen Fields,HR,Pending
Present,56,3372.98,2025-03-31,Ashley Thomas,ywebb@hotmail.com,Male,Mid,March,Patricia White,During case media expect second thousand probably itself exist happen month indeed yes.,8,London,Q3,71826.09,Tiffany Phillips,Support,Pending
Present,36,2454.26,2025-05-01,Emily Fowler,tracygraham@richmond.com,Female,Junior,June,Matthew Ford,Cultural draw actually water treatment others.,10,New York,Q4,38272.63,David Sheppard,Support,Pending
Absent,63,3335.23,2025-03-23,Cindy Warren,robert04@yang.org,Male,Junior,May,Jeffery Kennedy,Century student hot hope those deal movie.,9,Mumbai,Q1,96389.55,Andrea Benson,HR,Pending
Present,22,4114.53,2025-01-12,Jeremy Freeman,gregory85@white.com,Male,Mid,September,David Jackson,Rest sense down agent over interview design.,10,New York,Q3,117939.09,Laura Mccoy,Marketing,Pending
Absent,68,1529.52,2025-03-28,Cynthia Owens,jonathan94@cabrera-cox.com,Female,Junior,March,Michelle Conner,Ten little factor human standard police risk leader in.,1,London,Q2,36615.14,Frederick Ford,Sales,In Progress
Present,38,3167.88,2025-03-25,Julia Richardson,tapiabrian@parks.net,Other,Lead,April,Kelli Taylor,Left organization six history seek have.,8,New York,Q2,68527.18,Rebecca Howard,Sales,In Progress
Absent,81,3676.73,2025-04-12,Arthur Murray,wrightsonia@yahoo.com,Male,Lead,October,Allison Barrett,None foot character various want party professional may look pass responsibility.,9,London,Q3,102569.24,John Martinez,Marketing,In Progress
Absent,35,3270.92,2025-04-17,Ricky Flores,cstephens@johnson.com,Male,Senior,October,Mark Harrison,Evening matter effect enjoy interesting teacher fly nice research charge Congress degree yard.,4,Mumbai,Q3,98649.79,Danielle Gilbert,Development,Pending
Absent,55,3815.99,2025-01-25,Linda White,zachary31@williamson-erickson.biz,Female,Senior,September,Allison Strickland,Trial term serve point political really.,8,London,Q2,117493.4,Sandra Potter,HR,Completed
Present,16,1564.05,2025-02-07,Sonya Duncan,carolnguyen@gray.com,Female,Mid,March,Derrick Hobbs,Charge since system degree positive necessary goal later threat single.,3,Tokyo,Q2,32540.18,Molly Jacobs,HR,Completed
Present,12,2859.99,2025-03-03,Craig Kelly,leroycraig@gonzales.net,Male,Lead,March,Amanda Phelps,Involve church knowledge rich employee deep national break east expect tend.,5,Tokyo,Q4,97749.29,Carol Garcia,Development,Completed
Present,8,2807.21,2025-04-22,Joseph Johnson,timothycochran@yahoo.com,Other,Junior,January,Samantha Hanna,Speech agreement either show trade down.,2,Sydney,Q4,35720.76,Cindy Payne,Marketing,Completed
Present,8,2347.51,2025-04-04,Joshua Barnett,lesliefernandez@yahoo.com,Other,Mid,October,Tammy Jones,Season government mention general morning four theory worry tell security.,2,Tokyo,Q2,60261.41,Joseph Smith,Sales,Pending
Absent,9,1923.16,2025-02-27,Michael Garcia,warnerdaniel@yahoo.com,Male,Junior,June,Breanna Miles,Else big evening rather billion relationship see develop eye agree thus raise.,10,New York,Q3,116190.85,Ms. Gabrielle Khan,HR,Pending
Present,37,4395.22,2025-01-19,Ricardo May,christophergarcia@gmail.com,Male,Junior,November,Tyler Summers,Then deep ten thousand than now good lay behavior modern performance relate.,7,Tokyo,Q1,73235.87,Mary Quinn,Sales,In Progress
Present,44,4739.22,2025-04-05,Christian Briggs,xchan@yahoo.com,Other,Mid,March,Kimberly Diaz,Language under capital enter wall usually purpose ok.,10,Mumbai,Q2,85327.01,Brandi Rodriguez,Development,Completed
Absent,23,1222.46,2025-04-25,Norman Schmidt,johnsonjeffrey@gmail.com,Other,Junior,April,Dustin Lara,Structure activity leave both need fact although foot listen sign your either also.,5,Mumbai,Q3,116565.64,Shawn Larson,Development,In Progress
Present,72,3038.23,2025-03-26,Lorraine Barrett,pdavies@hotmail.com,Other,Senior,February,Stefanie Anderson,Just how cultural century degree staff myself support.,7,Tokyo,Q1,53855.01,Andrea Aguilar,Development,Pending
Present,25,1099.43,2025-03-06,Carlos Dennis,anne36@sanchez.com,Other,Senior,May,Michael Andrews,Standard own off the whole property reach perhaps base.,10,Sydney,Q3,69279.28,Austin Woods,Marketing,Pending
Absent,29,4075.17,2025-01-16,Jennifer Gallagher,wendy95@hotmail.com,Male,Lead,April,Misty Jones,Win front interesting magazine serve show human.,3,New York,Q2,95140.25,Jon Armstrong,Marketing,In Progress
Absent,75,3692.8,2025-03-04,Brian Haley,jenniferellis@west.net,Other,Lead,May,Jack Wagner,Public but truth meet thank keep clear give.,3,New York,Q3,67291.61,Benjamin Smith,Development,In Progress
Present,77,4968.98,2025-03-06,Samantha Smith,ypham@harris.com,Female,Junior,January,Patricia Jones,Line operation become student the decide hour reality hope nearly employee ready.,8,Mumbai,Q1,65797.85,Sophia Tran,HR,Completed
Absent,70,4546.66,2025-05-06,Brandon Hawkins,whartman@smith.com,Male,Mid,November,Brian Holland,Dog cover capital study first star option hair include ask discussion.,7,Tokyo,Q1,46905.03,Nicholas Stevens,Sales,Pending
Present,2,4723.36,2025-02-14,Tracy Moore,bmartin@cabrera.biz,Female,Lead,June,Debra Hess,Nation goal firm many radio again close town note employee free really which.,7,Mumbai,Q2,93351.24,Jessica Mills,HR,In Progress
Present,96,1570.3,2025-03-20,William Johnson,imatthews@wilson.com,Male,Senior,February,Mark Clark,Somebody style baby heart why fly himself shoulder resource teacher reality tough call.,8,New York,Q4,86050.34,Virginia George,Sales,In Progress
Absent,74,3151.14,2025-04-21,Brett Jordan,morganchristopher@hodges-mason.biz,Male,Senior,September,Todd Mays,Stand wall Mr walk nearly front artist send value might interesting item example.,3,New York,Q1,45084.27,Pamela Smith,Development,In Progress
Present,38,2565.57,2025-01-08,Benjamin Little,edwardwalker@hotmail.com,Female,Mid,February,Jonathan Santos,Mr identify who expert resource value little person baby quickly draw.,2,London,Q4,93771.45,Christopher Boyle,HR,Pending
Present,62,2911.27,2025-04-23,Brandon Joseph,gwalker@munoz.com,Other,Junior,June,Julie Juarez,Future sell power piece brother summer again mind protect model few western small.,6,Sydney,Q4,109102.89,Jason Griffin,Support,Pending
Absent,31,1046.72,2025-02-16,Robin Ochoa,johnsonmonica@yahoo.com,Male,Junior,November,Adrian Pennington,Than story away doctor clearly second.,9,London,Q4,37963.35,Willie Mitchell,Support,In Progress
Present,76,1223.69,2025-02-07,Caitlyn Taylor,dstewart@fox.org,Other,Lead,April,Reginald Miller,Far future sure word report month.,3,Tokyo,Q2,49693.28,Craig Hughes,Support,Completed
Absent,19,3725.8,2025-04-16,Willie Winters,juanholt@gmail.com,Other,Lead,September,Jennifer Rivera,Occur blue whose focus like wish help enough skin.,1,Mumbai,Q1,32547.88,Christian Armstrong,HR,Pending
Present,12,4040.88,2025-01-27,Samuel Perez,isaiah31@yahoo.com,Other,Senior,April,Brett Rangel,Central phone staff always impact focus nature should analysis pattern stock focus opportunity.,5,Mumbai,Q3,60264.19,Thomas Collins,Marketing,Completed
Absent,19,1103.18,2025-02-06,Jimmy Rasmussen,smitherika@hotmail.com,Female,Junior,April,Isaac Smith,Only accept wife section tree however Congress sort somebody eight small per number.,8,Tokyo,Q2,72125.89,Benjamin May,Support,In Progress
Present,71,2501.61,2025-03-06,Christine Joyce,jacksonjohn@gmail.com,Other,Mid,January,Phillip Meyer,Agent particularly budget little technology large.,9,London,Q2,37956.03,Michael Ellis,HR,In Progress
Absent,56,4360.29,2025-03-17,Tanner Robinson,khancatherine@cantu.biz,Male,Senior,November,Heather Padilla,Material lot service point place hope land.,3,Tokyo,Q2,84495.41,Samantha Weiss,Development,Pending
Present,1,2181.56,2025-02-25,Nancy Young,william82@hotmail.com,Female,Senior,July,Denise Smith,Should section garden believe seem reach reach rise every truth others.,4,New York,Q1,88386.78,Nicholas Kirk,Marketing,In Progress
Absent,79,1236.98,2025-02-14,Lisa Young,gsmith@johnson-patton.com,Other,Mid,April,Amanda Molina,Toward stuff leg environmental structure behind necessary technology land later pull source.,4,Mumbai,Q4,81636.17,Patrick Jefferson,Development,Pending
Absent,60,4462.4,2025-04-16,Lee Matthews,oliviaford@charles.com,Male,Mid,December,Gordon Rose,Do politics yard song head including.,8,London,Q1,40225.63,Charles Bailey,Support,Pending
Absent,28,2738.69,2025-03-11,Grace Silva,martin99@beard.com,Male,Junior,January,Jennifer Hensley,Article subject born Democrat war think age traditional real night well any reveal.,8,Sydney,Q3,34873.2,Andrew Dixon,Sales,Pending
Absent,54,3208.82,2025-04-26,Carol Watson,melissajones@gmail.com,Male,Junior,December,Tony Bailey,Fire bank just without foreign establish bad himself.,9,London,Q2,82254.0,Dustin Smith,Development,Pending
Present,6,1742.57,2025-04-09,Emily Powell,qmarks@saunders-bailey.com,Other,Lead,December,Justin Carpenter,Once behind tough south large talk quite project PM relate without.,7,Sydney,Q2,51660.06,Mckenzie Williams,HR,Pending
Present,94,4995.12,2025-02-28,Robert Newman,diazelizabeth@gmail.com,Male,Mid,August,Joe Morrison,Bring into from couple property administration price cultural.,9,Mumbai,Q4,91406.05,Christopher Diaz,Development,In Progress
Present,40,4988.48,2025-01-22,Barry Noble,gutierrezstefanie@maxwell-miller.com,Male,Senior,March,Lisa Day,Structure entire weight security able attack special myself.,9,New York,Q2,45715.9,Christopher Brooks,HR,In Progress
Absent,28,1326.72,2025-04-04,Michael Wheeler,osmith@spears.com,Female,Lead,May,Erin Schneider,Couple sense these paper similar effort three mouth already get become service rise.,6,Mumbai,Q2,42044.48,Jesse Clements,Sales,Completed
Present,22,1691.52,2025-04-29,Charles Jones,denniscrawford@yahoo.com,Female,Lead,April,Ryan Thompson,Shoulder tell artist ten hospital someone company edge determine.,6,London,Q3,102952.17,Julian Rodriguez,Support,Pending
Absent,33,3900.43,2025-01-09,Wanda Mays,rachelgrant@hotmail.com,Male,Junior,January,Jay Fox,Heart idea indicate year central reason.,2,Mumbai,Q3,84519.69,Andrew Harvey,HR,Completed
Absent,12,1753.63,2025-03-15,Sarah Olson,vchambers@hotmail.com,Male,Mid,October,Krista Reeves PhD,Back often social buy week pick bank.,8,Sydney,Q3,73510.11,Wesley Nguyen,HR,Completed
Present,43,1167.33,2025-04-03,Robert Blake,nicholasroy@murray-estrada.biz,Other,Senior,March,William Perez,Whom travel so offer break shoulder enough local.,5,Tokyo,Q2,56006.49,Russell Lawrence MD,Marketing,Completed
Absent,64,3189.59,2025-01-29,Jenna Ramos,richard06@hotmail.com,Male,Junior,October,David Moody,Drive effect trial rate fall exactly yes bit daughter drug.,2,London,Q1,106445.27,Robert Wang,Marketing,Pending
Present,30,2006.83,2025-04-20,Henry Osborn,jcampbell@jackson.com,Female,Lead,April,Sean Copeland,Industry person dog color single risk pass either represent at.,9,Mumbai,Q3,85043.77,Joshua Martin,Sales,In Progress
Present,60,4150.04,2025-01-20,Dr. Christian Banks Jr.,taylorrobin@yahoo.com,Female,Senior,March,Jeanette Mullins,Party mission rise senior action tend summer treat base mouth after.,1,Mumbai,Q2,33651.29,Erika Davis,Sales,In Progress
Absent,84,4298.63,2025-02-18,Preston Williams,brett79@flores.com,Male,Mid,October,Daniel Mcdowell,Upon even however focus use care mind.,1,Mumbai,Q2,69961.03,Taylor Sanchez,Marketing,Pending
Absent,83,4388.36,2025-04-29,Melanie Ruiz,kyleleon@yahoo.com,Female,Lead,June,Theresa Bates,Partner charge recent difficult film never senior audience responsibility.,5,Mumbai,Q2,83054.77,Bradley Davis,HR,Completed
Absent,5,4678.17,2025-04-07,Amanda Kaiser,nicholsshannon@gmail.com,Other,Junior,May,Kathleen Reyes,Successful executive vote soon trial point her live.,1,Tokyo,Q4,85264.21,Katherine Garcia,Sales,Completed
Absent,59,3316.4,2025-05-01,Michael Griffith,keith98@yahoo.com,Female,Mid,December,Jennifer Gay,Development even growth pattern recent appear product.,7,New York,Q3,108854.29,Richard Morales,HR,Pending
Present,40,2966.68,2025-04-24,Dr. Kimberly Kelly,claudia65@tran.com,Male,Senior,March,James Livingston,Understand reach meet operation magazine newspaper cultural current every value.,5,London,Q2,52501.43,Kevin Adkins,Marketing,Pending
Present,34,2675.51,2025-01-19,Melissa Taylor,tanya45@roach.com,Female,Lead,October,Michael Braun,View leg child special two officer charge movie activity game agreement hold.,5,Sydney,Q2,44016.44,Dr. Darrell Crawford,Marketing,Pending
Absent,94,3254.0,2025-03-13,Daniel Jones,mdorsey@hotmail.com,Female,Junior,October,Matthew Cobb,Will adult accept probably issue while piece film.,3,London,Q2,91679.29,Karina Burns,Marketing,Pending
Absent,22,4278.06,2025-04-22,Kelsey Allen,burchmichael@carroll.biz,Other,Senior,April,Jennifer Jones,Soon rock perhaps budget perhaps admit trouble piece which by support hundred stage spring.,5,London,Q3,101941.0,Jamie Graham,Marketing,Completed
Present,7,4958.58,2025-01-14,Kayla Torres,jaimevillarreal@yahoo.com,Female,Lead,March,David Smith,You open student long teach action population toward edge.,2,New York,Q2,108614.04,Michael Moore,Support,Pending
Present,97,4907.65,2025-03-05,Darlene Barnes,loganchristopher@andrews-jenkins.net,Male,Mid,October,Tina Taylor,Main special collection military continue customer pick movement outside.,9,Mumbai,Q4,84172.27,Jacob Sanchez,Sales,Pending
Present,94,3260.92,2025-02-10,Kathy Blackburn,kramos@townsend-owens.info,Other,Senior,December,Ian Shea,Standard modern own see new these still in figure time interest simple know.,3,New York,Q2,57677.53,Sarah Ponce,HR,In Progress
Present,52,4500.2,2025-03-25,Lauren Lopez,kmcdonald@holloway.com,Female,Junior,March,Katherine Thomas,Stock rate best instead around resource question soldier ball of information.,7,Sydney,Q4,98871.03,Susan Barton,Sales,Completed
Absent,60,1705.23,2025-01-31,Shannon Fleming,smitchell@gmail.com,Female,Lead,July,Jared Davis,Model sure lawyer eat goal next among doctor allow something film.,8,Sydney,Q4,86435.48,Michael Collins,HR,Pending
Absent,79,1322.13,2025-03-22,Roberto Francis,ewebb@johnson.com,Other,Senior,December,Melissa Coffey,Institution two identify others present quite society computer.,6,Mumbai,Q2,105031.3,Kristen Ward,HR,Pending
Present,67,3991.57,2025-02-08,Kevin Sutton DDS,tammyashley@martinez.com,Other,Junior,May,Ashley Landry,National even discussion action person nor from experience.,3,Tokyo,Q3,46278.52,Earl Douglas,HR,Completed
Present,21,3536.19,2025-02-23,Anthony Hernandez,faulknerchristian@palmer.com,Other,Senior,February,Kevin Singleton,Significant bar across clearly kid hundred near.,10,Sydney,Q3,80652.45,Elizabeth Hoffman,HR,In Progress
Absent,2,2902.43,2025-04-23,Kelly Jones,marylambert@yahoo.com,Other,Junior,January,Morgan Padilla,Exactly food Democrat old allow remember.,2,London,Q2,86869.99,Priscilla Marshall,Sales,Pending
Present,58,4067.23,2025-02-27,Beth Jimenez,donald15@fox-lindsey.com,Male,Junior,February,Rebecca Wu,Catch simply pattern pressure source especially finally give.,10,Sydney,Q3,95144.34,Samantha Rogers,HR,Completed
Present,2,1951.18,2025-02-27,Jennifer Mcintosh,lambertshawn@hotmail.com,Other,Senior,October,Kelly Hamilton,Along cell almost direction skin simple create increase through recently director.,2,Tokyo,Q1,68781.84,Roger Rodriguez,Sales,Pending
Absent,70,2656.15,2025-04-19,Michelle Jones,yoderevelyn@yahoo.com,Female,Junior,April,Scott Krueger,Response financial yeah writer three poor remain.,8,London,Q4,47321.18,Gerald Hanson,Sales,In Progress
Absent,22,4304.03,2025-01-12,Catherine Oconnor,margaretrice@mcclain.biz,Other,Junior,January,Cynthia Snyder,Always across discussion magazine amount live.,3,Sydney,Q4,108849.0,Justin Wright,Development,Pending
Present,42,1595.22,2025-03-07,Paul Houston,ykline@mueller.org,Male,Senior,January,Joshua Armstrong,How hundred model sport face instead capital want individual public.,5,New York,Q3,45006.63,Jennifer Wolfe,Marketing,Completed
Present,40,3795.79,2025-02-03,Crystal Jackson,amanda85@gmail.com,Female,Lead,December,Kari Ray,Religious than ago coach remember imagine what economy reality.,5,Tokyo,Q4,35203.47,Heidi Thompson,Sales,Pending
Absent,43,4778.82,2025-04-18,Briana Sanchez,taylor23@smith.info,Other,Lead,April,Diane Escobar,Talk full trouble type thought own pretty hit food improve factor young.,2,New York,Q1,46832.17,Randall Benitez,Development,Completed
Present,29,4565.29,2025-02-11,Shawn David,ohernandez@smith-reilly.net,Female,Lead,April,Alexis Barrett,Ball provide fight way nature mother design school country record state outside.,5,Sydney,Q2,80304.86,Stephanie Phillips,Support,Completed
Present,6,4996.65,2025-03-11,Amber Page,andrew74@gmail.com,Male,Mid,March,Francis Nguyen,Bill behavior as paper so something seek old car specific style official give.,9,London,Q2,107845.85,Laura Martin,Development,Completed
Absent,59,3954.78,2025-01-24,Dr. Melinda Freeman,bensonderek@hotmail.com,Other,Mid,March,Angel Brady,Heart create middle policy down beat face enough.,3,Sydney,Q3,79422.82,Charles Jones,Marketing,In Progress
Absent,90,2546.16,2025-02-13,Christopher Clark,estevens@gmail.com,Other,Lead,February,Brandon Hurley,Past despite short meet picture only far look rather serious more my time.,2,Tokyo,Q4,49599.89,Gabriella Williams,Development,Completed
Present,88,1831.45,2025-02-08,Brian Williams,andrew11@jackson-ramirez.com,Female,Junior,February,Mark Cameron,Carry office center industry what blood environment do success purpose reflect blue low car.,6,Mumbai,Q1,81011.35,Stephanie Lawson,Support,Pending
Absent,60,3030.21,2025-05-03,Marisa Rice,jennifer37@yahoo.com,Female,Junior,June,Brittney Thomas,Provide rise stay recent remember you clear city their data.,7,Sydney,Q4,101004.62,Sarah Adams,Development,In Progress
Absent,44,1763.81,2025-01-11,David King,peggymccann@bowers.com,Male,Senior,December,Marissa Mitchell,Hospital street movie technology determine protect light ask week.,2,Mumbai,Q1,55755.06,Jacob Ramos,Development,Pending
Present,2,2069.84,2025-01-01,Heidi Rosales,scottanderson@horne-cooke.org,Female,Lead,March,Deborah Davis,Number data voice again anyone yourself administration instead since science find many free.,7,London,Q2,67579.62,Amy Hubbard,Development,In Progress
Absent,93,1303.24,2025-04-06,Duane Donovan,lopezsandra@dyer.info,Other,Junior,December,Teresa Watson,Suddenly crime office movement it general parent affect teacher with.,6,Mumbai,Q3,33924.13,Carmen Potter,Sales,Completed
Absent,61,3496.77,2025-01-16,David Wolf,kellyronald@hotmail.com,Other,Lead,June,Eric Johnson,Ten candidate fear situation open maybe become meet.,4,Sydney,Q4,89494.85,Robert Green,Marketing,In Progress
Present,58,1800.02,2025-03-15,James Gill,grodriguez@richard-smith.com,Female,Junior,January,Mrs. Amy Paul DVM,Tend certainly card support type hand enjoy range represent involve say.,3,New York,Q3,48769.44,Carlos Stokes,HR,Pending
Present,80,3163.81,2025-01-05,Paula Bauer,scottbrown@hudson.net,Male,Senior,March,Justin Stanley,Us responsibility news hope kitchen official toward much later recent American should.,3,Tokyo,Q2,114713.6,Joseph Myers,Sales,Pending
Present,94,1785.68,2025-04-26,Brittany Short,jburns@gmail.com,Female,Junior,January,Steven Zuniga,Since education young staff small full require statement.,9,Mumbai,Q4,33196.13,Crystal Burton,Development,Pending
Present,97,2896.91,2025-02-16,Dawn Sims,campbellmckenzie@gmail.com,Female,Junior,March,Jacqueline Ferguson,Before establish radio site really under discuss walk we myself individual.,6,Tokyo,Q1,108819.24,Joshua Morgan,Sales,In Progress
