Present,62,2392.16,2025-01-05,Andrew Duarte,dakotajoseph@le.com,Male,Senior,March,James Nicholson,Change material reason different citizen talk.,9,Mumbai,Q4,54214.91,Sheila Landry,Marketing,Completed
Absent,62,1534.4,2025-02-15,Troy Calderon,kbarnes@hotmail.com,Other,Mid,October,Christopher Lewis,Purpose happen news particularly general minute role poor.,3,New York,Q2,118608.4,Dakota Potts,Sales,Pending
Absent,97,2264.3,2025-02-14,William Ramos,meagan57@yahoo.com,Male,Mid,January,Adam Lee,Hit buy approach national without director exist another lot.,1,Sydney,Q3,110514.3,Lucas Davis,HR,Pending
Present,48,4883.73,2025-02-09,Lance Garcia,kimberlyrosario@yahoo.com,Male,Senior,November,Samuel Huffman,When with maintain speech letter store at treatment.,3,Mumbai,Q2,103145.16,Jennifer Rogers,Development,Completed
Present,79,4054.16,2025-03-20,Amy Hall,sherry26@proctor-evans.com,Male,Junior,May,Jason Mcguire,Baby subject cell mind line buy growth.,8,New York,Q4,112102.07,Allison Juarez,Development,In Progress
Present,6,2162.72,2025-02-10,Heather Sims,teresa42@gmail.com,Male,Junior,July,Jesse Henderson,Hair guess level stock true performance month fight detail feel.,6,Mumbai,Q1,100064.03,Christopher Cole,Marketing,In Progress
Absent,99,3920.69,2025-01-18,Rebecca Smith,kimberlybaldwin@leach.net,Male,Senior,April,Paul Lopez,Develop course pattern bank can especially rise imagine stuff however magazine offer.,10,New York,Q2,30997.51,Tami Williams,HR,Pending
Absent,65,4783.91,2025-03-14,Margaret Ruiz,juliajohnson@brown.com,Male,Mid,May,Gloria Willis,Most eight exactly then morning movement simply.,5,Sydney,Q2,44386.81,Julia Wyatt,Development,Completed
Present,42,2106.65,2025-05-01,Mario Jones,psexton@gmail.com,Female,Lead,June,Brian Hayes,More area total international feeling help sign travel.,8,London,Q2,56818.6,Kelli Anderson,Marketing,Pending
Present,67,1001.02,2025-01-05,Joshua Jones,nwilliams@johnson.com,Male,Lead,March,Laura Welch,Along city hard local short avoid.,4,London,Q3,91205.93,Alicia Yu,Development,In Progress
Present,41,2984.53,2025-02-08,Katie Moore,davidrodriguez@wells.net,Female,Senior,September,Craig Garcia,Through least quickly line central police skin leave.,5,Sydney,Q4,90026.08,Joseph Chavez,Support,In Progress
Present,18,2058.75,2025-03-11,Dana Williams,oconnorchristian@gmail.com,Other,Senior,April,Angela Ross,Against pick sure three star main you operation black material once development effort.,10,Tokyo,Q4,61786.12,Jacqueline Lowery,HR,In Progress
Present,74,3987.49,2025-04-29,Karen Rodriguez,scott00@hotmail.com,Female,Lead,March,James Cox,Week treat society moment charge none always civil staff difference capital.,7,Tokyo,Q4,72227.35,Tammy Green,HR,In Progress
Present,31,3797.83,2025-03-12,Suzanne White,millerderek@carter.com,Male,Junior,August,Craig Holder,Southern culture media option agree expect north left those rest discuss while.,1,London,Q2,108910.56,Timothy Chandler,Development,Pending
Present,88,4749.63,2025-03-05,Bradley Green,waterserica@smith.com,Male,Junior,March,Brittany Smith,Evidence exactly house choice where indeed receive get wonder general.,10,New York,Q3,64714.82,Lisa Parker,Sales,Pending
Present,92,4163.42,2025-03-19,Jessica Dougherty,robertgrant@hotmail.com,Female,Mid,December,Nicole Sullivan,Represent dark just year cold check enough others science agency election but.,2,Sydney,Q3,88362.57,Randall Johnson,Sales,Completed
Absent,89,4878.5,2025-04-04,Samuel Jackson,qhernandez@fowler.com,Male,Mid,June,Madison Norman,Friend my help series speak fact day tend.,10,London,Q4,72695.45,Jacob Lawrence,Development,In Progress
Present,51,1944.67,2025-04-09,Brandy Taylor,james56@gmail.com,Female,Junior,April,Todd Hernandez,Have certainly me only perhaps physical raise magazine culture.,7,New York,Q3,104571.15,Heather Waller,Support,Pending
Absent,13,2780.23,2025-04-12,Lisa Gilbert,kimberlyvance@hotmail.com,Female,Mid,December,Karen Kaufman,Plant design view experience others there home off majority interest.,9,Sydney,Q2,81139.16,Holly Marks,Support,Completed
Present,57,1606.4,2025-04-26,Ronald Oconnor,robinwarner@hotmail.com,Female,Junior,November,James Bowman,Your stock store military pay pressure professional.,3,Sydney,Q2,56957.15,Tiffany Huber,Sales,In Progress
Absent,47,3964.19,2025-02-27,Jose Hicks,jerrywillis@hotmail.com,Female,Junior,October,Gavin Sanders,Town book white research me a somebody arrive.,1,Mumbai,Q1,113112.43,Dr. Evelyn Clark DVM,Sales,Pending
Present,15,2276.81,2025-05-03,Danny Holland,whitneynicholson@hotmail.com,Other,Junior,February,Michelle Matthews,Home lead impact everything meet piece appear society film father ever box interest.,9,Tokyo,Q4,110515.63,Manuel Santos,Marketing,In Progress
Present,32,4832.55,2025-02-03,Megan Martinez,jamesbush@yahoo.com,Female,Junior,April,Tiffany Randolph,Today one month board nation home raise level.,6,Tokyo,Q3,74868.57,Michele Greene,Sales,Pending
Present,28,2358.32,2025-02-25,Patty Carter,nwallace@gmail.com,Female,Junior,June,Laurie Edwards,Any off gas special action Mr safe service.,3,London,Q3,75757.54,Elizabeth Ayers,HR,In Progress
Present,95,1328.6,2025-02-03,Gregory Robinson,cindyhoffman@palmer-davis.com,Female,Lead,July,Ryan Jackson,Realize discover begin country themselves garden them.,6,Tokyo,Q2,58818.14,Brenda Frazier,Development,Pending
Present,36,4712.96,2025-02-25,Hayden Adams MD,newmantaylor@hotmail.com,Other,Junior,February,John Davenport,Alone bag art cell nature worry successful town.,6,Tokyo,Q4,34292.71,Amy Morales,Sales,Pending
Absent,46,3627.53,2025-01-09,Angelica Schneider,andrewstafford@hotmail.com,Other,Senior,July,Jeffrey Garrett,Image certainly learn international among buy.,4,New York,Q3,44568.39,Ralph Schwartz,Support,Completed
Present,88,2327.63,2025-02-08,Jo Rivera,owensdeborah@richardson.org,Other,Senior,October,William White,Car our standard forget upon art stuff determine many authority.,3,Sydney,Q4,86717.24,Melanie Morgan,Marketing,In Progress
Present,34,3177.0,2025-03-21,Dominique Jacobs,jennifercurtis@yahoo.com,Female,Lead,November,Christina Rivera,Evidence measure very run management sound conference carry.,3,New York,Q2,82717.79,Jordan Jackson,Support,Pending
Present,88,1753.46,2025-04-29,Taylor White,julianperry@lynch.net,Female,Junior,December,Denise Wallace,Trial when until state take deep quite center center across.,6,London,Q4,101839.4,Robert Gillespie,HR,Pending
Present,66,3512.42,2025-02-04,Eduardo Miller,skerr@kane.com,Male,Junior,June,Joe Young,Positive world office reflect three woman everyone.,6,Mumbai,Q1,55470.51,James Williams,Support,In Progress
Absent,38,2323.9,2025-01-26,Andrea Bond,jhernandez@carter-bishop.org,Other,Lead,February,Kimberly Hawkins,Event religious kid again mention east.,2,Sydney,Q1,50450.13,Sandra Marshall,HR,Completed
Present,71,3086.9,2025-04-19,Kimberly Carpenter,scottdon@gibson.net,Male,Senior,June,Alexis Hensley,Friend key material drop enough water.,3,Mumbai,Q3,54846.31,Stephanie Dodson,Marketing,In Progress
Absent,36,4350.54,2025-03-24,Christopher Burnett,matthew87@rivera.info,Female,Junior,January,Jason Barnes,Military hundred security house sister ready according including money generation.,1,Tokyo,Q1,76715.62,James Knapp,Marketing,In Progress
Absent,48,2067.6,2025-04-13,Rickey Harris,donaldscott@yahoo.com,Male,Mid,January,James Jones,Fine civil evening institution owner summer mouth manager sense me against during.,7,London,Q2,115669.96,Jamie Carter,Sales,In Progress
Absent,66,1109.51,2025-01-21,Clayton Martinez,davisbarbara@hotmail.com,Female,Lead,July,Kevin Williams,Law trial interesting remember fear according require beautiful we candidate.,9,Tokyo,Q3,97399.37,Gary Sullivan,Support,Pending
Absent,24,4028.25,2025-04-02,Logan Klein,martinjames@gmail.com,Female,Lead,December,Kenneth Randolph,Ball fill region indicate above front sense note book.,1,Tokyo,Q2,41900.64,Kelly Carlson,Sales,In Progress
Absent,20,2063.69,2025-01-07,Curtis James,ericstrong@yahoo.com,Female,Junior,December,Thomas Gilbert,Evening red happy officer tonight each.,1,London,Q1,101162.32,Kyle Collins,Sales,Pending
Absent,15,2660.78,2025-03-03,Dana Williams,stevenevans@santos-brown.com,Male,Mid,February,Caroline Garcia,Travel physical fill need decide detail specific teach.,7,Sydney,Q2,43122.47,Julie Todd,Sales,In Progress
Absent,35,4972.37,2025-05-01,Calvin Irwin,flemingjeremiah@haynes-wilkins.com,Female,Senior,July,Robert Jones,During prevent really test herself economy.,9,London,Q1,65666.1,Christian Martinez,Sales,Pending
Present,38,4337.49,2025-04-20,David Rodriguez,fkennedy@morales.org,Female,Senior,January,Christine Foster,Six increase compare employee different wall lay study outside meet.,5,New York,Q3,66273.07,Penny Turner,Marketing,Pending
Present,17,1258.6,2025-05-06,Gavin Hughes,jasonsilva@stewart.biz,Male,Lead,September,Miguel Short,Specific pay him so PM away mind.,9,Sydney,Q4,86479.38,Timothy Case,Sales,Completed
Present,96,2870.93,2025-01-16,Angela Aguirre DDS,hsmith@beasley.com,Female,Senior,December,John Espinoza,His lay raise light maybe piece last expect.,9,Tokyo,Q2,96381.48,James Hansen,HR,In Progress
Present,8,2561.7,2025-02-15,Michael Lewis,lukebrooks@morrison.com,Other,Senior,May,Erik Perez,Positive letter of would anyone fish training above production.,3,Sydney,Q2,79562.2,Kelly Dunn,Support,Completed
Absent,74,1510.75,2025-03-25,Shannon Estrada,pamelahawkins@wilkerson-johnson.com,Female,Senior,April,Kathryn Diaz,Table professor pass determine girl tax finally rather wind fact although so.,4,Sydney,Q2,45265.72,Evelyn Morales,HR,Completed
Present,61,2842.57,2025-02-18,Rhonda Vargas,davisdaniel@gmail.com,Male,Lead,May,Andrea Curry,Career down take successful election act national thousand home.,6,London,Q4,61156.37,Alicia Hall,Development,In Progress
Absent,86,2543.75,2025-04-05,Kyle Pope,charles00@sanchez.biz,Female,Lead,August,Stephanie Reed,Hot local other reality charge reduce soon center.,5,Mumbai,Q3,71549.39,Daniel Moore,Marketing,Completed
Present,46,2869.98,2025-04-17,Vicki Reid,owilliams@clark.com,Other,Lead,November,Charles Hodge,Grow themselves best will how indicate.,4,New York,Q1,93686.5,Austin Jacobs,HR,In Progress
Absent,61,2759.16,2025-02-17,Jennifer Johnson,uhardin@norris.com,Other,Senior,May,Brian Ferguson,There person upon card wide sometimes impact.,10,Tokyo,Q2,115279.49,Isaac Walter,Sales,In Progress
Absent,13,3736.56,2025-04-05,Danielle Newton,joan47@gmail.com,Male,Mid,December,Laura Hill,Down sound same hear family court court edge serve most season travel.,3,New York,Q2,96192.65,Lisa Porter,HR,Pending
Present,49,1156.75,2025-04-22,Carolyn Harris,jameskim@hotmail.com,Female,Mid,July,Samantha Solis,Operation whether fight as bar difficult citizen these clear new.,10,New York,Q2,30930.03,Brooke Miranda,Support,Pending
Absent,74,3279.37,2025-03-06,Mr. David Macdonald,gbarber@gmail.com,Female,Lead,June,Joseph Diaz,Throw future success day from even.,5,New York,Q4,61754.62,Kristi Diaz,Marketing,Completed
Absent,30,1285.56,2025-02-23,Penny Thomas,jefferysmith@yahoo.com,Male,Mid,April,Aaron Palmer,Green environment either today truth month page.,7,Mumbai,Q4,42294.05,Monica Carpenter,HR,In Progress
Absent,5,2978.11,2025-02-19,Dennis Hayes,jo27@yahoo.com,Female,Junior,May,Danielle Wilson,Story third agreement Congress civil sometimes public partner foot coach professor.,1,Sydney,Q1,41636.49,Colin Pittman,Support,Completed
Absent,75,1006.94,2025-05-03,Dale Miles,catherine39@yahoo.com,Female,Junior,August,Juan Kennedy,Base never test detail arrive action near movement story south though seek head.,9,Sydney,Q3,109522.57,Robert Cook,Marketing,Pending
Absent,76,2752.43,2025-01-13,Daniel Stewart DVM,andrew69@gmail.com,Other,Lead,June,Melissa Davis,Huge full discover product community here any head performance yard early similar building.,3,Sydney,Q2,82388.08,Lindsay Trujillo,Marketing,Pending
Absent,98,4516.09,2025-01-17,Anita Alvarez,hacevedo@hotmail.com,Male,Senior,July,Troy Reynolds,Both fear soldier allow wife deep understand against make subject there democratic.,8,New York,Q4,56418.77,William Ramos,Marketing,In Progress
Present,48,4073.86,2025-05-07,Mr. Walter Cantu,swilliams@gmail.com,Male,Mid,August,Jacob Dawson,According cup worker letter dog modern win.,10,London,Q3,97973.81,Benjamin Martinez,Development,Pending
Absent,48,2649.39,2025-02-03,Diane Davis,xwolfe@matthews.com,Male,Lead,June,Virginia Farrell,Rest beautiful suddenly example oil experience such including simply whom.,7,London,Q1,86450.29,Justin Lowery,Support,Pending
Absent,83,1928.32,2025-03-09,Steven Allen,weaverrobert@bennett.com,Male,Senior,December,Linda Love,Into serious family responsibility than too.,1,London,Q3,70911.52,Roger Martinez,Marketing,Pending
Present,64,1767.91,2025-01-01,Mrs. Mikayla Morrison DVM,joseph34@tran.com,Male,Junior,December,Jonathan Cox,Anyone model color party physical decide song high.,8,Mumbai,Q3,41013.32,Joshua Moore,Sales,Pending
Absent,1,4542.01,2025-01-26,Justin Ford,jeffrey87@meyer.com,Female,Lead,October,Elizabeth Macdonald,Season do similar determine various how foreign student save.,8,Mumbai,Q1,105546.85,Casey Berry,Support,Pending
Absent,77,1823.76,2025-04-17,Edwin Peterson,millerjacqueline@hotmail.com,Male,Mid,October,Jesus Villegas,Floor born wrong later poor nice finish leader.,7,Mumbai,Q4,38913.17,Peggy Martin,Sales,Completed
Present,15,4106.27,2025-03-06,Jamie Harris,ramosbridget@beck-lawson.com,Male,Lead,December,Cindy Stafford,Professional hope structure voice wait know Republican somebody protect Mr former for let.,4,Tokyo,Q2,80345.49,Matthew Klein,HR,Pending
Absent,36,4916.78,2025-04-26,Brian Wu,maria41@hotmail.com,Female,Mid,June,Eric Miller,Stock prepare performance black pay training magazine staff group commercial work.,10,London,Q3,34135.81,Amy Chapman,Support,Pending
Absent,65,2732.91,2025-01-14,Raymond Diaz,sergio06@turner-skinner.com,Male,Senior,June,Angela Bush,Ago old record especially different age process front option hard address.,7,Mumbai,Q1,107932.72,Thomas Williams,Marketing,Completed
Present,26,2865.11,2025-01-28,Lori Taylor,ejones@yahoo.com,Male,Junior,August,Joseph Rodriguez,Step senior hour individual dream yourself stage else.,1,Tokyo,Q3,43827.46,Maria Braun,Marketing,Completed
Absent,44,2366.72,2025-04-22,Diana Hale,nicholasortiz@cruz.biz,Female,Senior,December,Adam Bell,Style old campaign certainly win lay trade history.,1,London,Q1,70267.75,Sarah Lopez,Sales,In Progress
Absent,81,4977.57,2025-01-29,Casey Wright,andrewbarker@santos-brown.com,Female,Junior,May,Brittany Brown,Identify voice recently field ok five artist exactly clear age form born.,6,New York,Q2,67004.4,Jessica Lewis,Marketing,Completed
Absent,60,3184.59,2025-01-19,William Kennedy,brian63@hernandez.com,Male,Junior,January,Christina Porter,Little clear policy name able stuff evidence yeah environment affect energy reveal north.,2,Tokyo,Q4,102480.95,Stephen Garcia,Support,Pending
Present,33,2810.27,2025-03-08,Tyler Brown,allisoncharles@graves-brown.com,Male,Senior,October,Darrell Perez,On everybody red child since who community far.,2,London,Q1,112527.35,Timothy Gonzalez,Support,Pending
Present,17,3686.05,2025-04-11,Lisa Coleman,robinsonbrittney@russell-mccoy.com,Other,Senior,January,Michael Harrington,Shake learn music brother he major about and.,1,Tokyo,Q2,109233.31,Joy Morris,Support,Pending
Absent,21,3441.25,2025-02-04,Glenda Turner,elizabeth99@hotmail.com,Female,Lead,November,Rhonda Smith,Itself staff chair base provide professor nice seek population into plan kid water.,9,Sydney,Q3,106820.11,Devin Fischer,HR,Completed
Absent,93,3789.22,2025-03-07,David Bishop,nicholassanchez@king-torres.org,Female,Senior,July,Derek Wright,Door year budget number age sign.,3,Mumbai,Q4,60759.81,Lori Cantu MD,Marketing,Completed
Present,32,4579.11,2025-04-24,Edward Harris,etran@campbell.com,Other,Lead,March,Michael Ramsey,It nor executive worry food under international issue how meet woman break.,10,Mumbai,Q2,103491.3,Ashlee Gordon,Development,Completed
Absent,84,2790.6,2025-01-08,Nathan Dudley,markwilliams@johnson.info,Female,Mid,October,Anthony Hardin,Training body leave while relate discover deal ok moment certainly its yourself.,1,New York,Q4,67871.36,Crystal Garcia,Support,Pending
Present,8,1279.26,2025-01-07,Nicholas Macias,bryanmarsh@hotmail.com,Other,Senior,February,Brittany Ramos,Walk boy protect debate good face.,8,Tokyo,Q3,89929.46,Alicia Villanueva,Marketing,In Progress
Absent,94,2301.26,2025-01-23,Ricardo Cook,silvarodney@yahoo.com,Female,Junior,November,John Brown,Skin evening suddenly similar head religious town industry policy crime.,1,New York,Q4,102297.56,Toni Hamilton,Marketing,Pending
Present,2,1000.28,2025-02-26,Gregory Andrews,rtaylor@jacobs.com,Other,Senior,April,Lisa Smith,Activity test election place include city college fire artist side go.,3,New York,Q2,95627.74,Tyler Garcia,Marketing,In Progress
Absent,4,3632.72,2025-04-26,Raymond Adams,feliciajohnson@hotmail.com,Female,Senior,October,Rebecca Smith,Site nothing practice maintain itself system.,4,New York,Q2,76198.25,Carla Osborne,Sales,Pending
Absent,32,1484.4,2025-05-11,Jordan Calderon,emilyorozco@hotmail.com,Male,Junior,May,Alicia Clark,Only able himself stock air color discover may reduce air program dog you.,3,Sydney,Q3,35753.46,Tracy Ramos,Support,Completed
Present,23,3276.37,2025-03-04,Steven Guzman,davidmorris@gmail.com,Male,Lead,December,Guy Blevins,What another wind anything visit enjoy want usually water world physical organization.,4,New York,Q4,69145.47,Gerald Nash,HR,Completed
Present,25,2533.35,2025-04-06,Monique Ashley,jasminemurillo@perry.net,Female,Lead,December,Jennifer Oconnell,Break soon chance season three others mission finally.,9,London,Q2,40639.15,Jessica Alvarez,Sales,Completed
Absent,20,1331.24,2025-02-10,Jordan Roberts,bentleyanna@moreno.com,Female,Mid,March,Jennifer Fernandez,East model rule police reach look positive expert current carry office product.,3,London,Q4,49617.17,Laura Byrd,Development,In Progress
Absent,63,3477.71,2025-01-18,Jenna Ramos,rowejennifer@gmail.com,Female,Junior,June,Brandon Powell,Owner increase control prevent chair dinner face doctor present scientist this.,10,London,Q2,44929.31,Jared Bailey,Development,Completed
Absent,65,3591.06,2025-04-27,Melissa Morales,ballsandra@flowers.net,Female,Lead,November,Shirley Roberts,Recently above marriage approach exactly another real.,2,Mumbai,Q4,95935.86,Sabrina Butler,HR,Completed
Absent,1,3606.72,2025-01-17,Pamela Stevens,zkemp@macdonald-ray.com,Male,Mid,May,Darryl Camacho,Hospital fall west know cut begin live.,9,Sydney,Q1,80552.8,Gabrielle Lamb,Marketing,In Progress
Absent,32,4709.72,2025-02-17,Jenny Mcgee,patriciahaynes@anderson.com,Male,Lead,October,Alexis Hunter,Happen individual process task future matter treat.,8,Mumbai,Q2,52728.69,Bryan Cox MD,Sales,Completed
Absent,67,1242.98,2025-02-16,Anna Williams,qrobinson@gmail.com,Female,Senior,November,David Evans,Ask tend myself scientist today receive goal election executive share situation.,10,New York,Q4,36201.26,Frank Moore,Marketing,Pending
Present,49,1359.52,2025-03-08,Kaitlyn Hernandez,williamscheryl@hotmail.com,Other,Mid,July,Kristin Evans,Fall itself sense say final true single glass entire skin much current organization.,1,London,Q4,53616.52,Erica Cohen,Support,Pending
Present,93,2001.05,2025-03-07,Shane Stephens,melissalambert@mathews-maxwell.com,Other,Senior,March,Alyssa Brady,In hit staff nearly office free thing tend town simply send.,9,London,Q2,70326.85,Dustin Neal,Marketing,Pending
Absent,89,1401.28,2025-04-29,Stephen Reynolds,zlambert@hotmail.com,Male,Lead,July,Justin Medina,Feel far manager shake effect help make cover politics room get church indicate.,4,Mumbai,Q4,35735.37,Brian Burke PhD,HR,In Progress
Absent,57,4254.16,2025-03-09,Antonio Price,allenlisa@garcia.info,Female,Junior,November,Madison Watson,Page that industry ago become available have.,2,Tokyo,Q3,76371.03,David Norman,Marketing,Completed
Present,34,4890.92,2025-02-17,Marc Ford,morrowchristopher@gmail.com,Female,Senior,January,Amanda Hall,Continue hope suddenly lawyer star audience leg beat go.,9,Mumbai,Q3,38946.97,Albert Hayes,HR,In Progress
Present,52,4131.19,2025-05-08,Henry Jenkins,alexanderdavid@yahoo.com,Female,Junior,August,William Peterson,Travel stay writer PM community past two year PM kid.,6,Tokyo,Q3,54662.07,Janice Smith,HR,In Progress
Absent,2,2471.52,2025-05-12,Zachary Burgess,williambradford@yahoo.com,Other,Lead,February,Thomas Potter,Century bar region street program fear huge now wife.,5,New York,Q1,107999.48,Maureen Johnson,HR,In Progress
Present,82,4187.51,2025-01-24,Tracy Fox,lsmith@espinoza.com,Male,Mid,September,Gregory Daniels,Oil will happy how how government hour material suffer lead.,6,Sydney,Q1,80999.68,Cody Norris,HR,Pending
Absent,90,3413.49,2025-03-12,Dominique Serrano,christopherbryant@gmail.com,Other,Mid,December,Jason Gill,All move believe help officer argue Republican various point.,10,Tokyo,Q4,63708.9,Ian Garcia,HR,Pending
Absent,60,4613.55,2025-04-05,Melissa Lowe,jarvisalex@smith-shah.com,Other,Senior,July,Robert Zamora,Which its simply kid popular oil then.,3,Sydney,Q1,69156.18,Danielle Moore,Development,Pending
Absent,67,2660.02,2025-04-17,Christopher Carson,virginiawebster@yahoo.com,Other,Lead,October,Amy Chen,Score stuff cell big year picture century dark natural account.,2,London,Q4,44576.02,Jasmine Williams,HR,In Progress
Absent,21,1554.96,2025-03-30,Tyler Williams,felicia07@stanton-russo.info,Male,Mid,January,Craig Guzman,Reflect reveal lay first understand would drive.,10,Sydney,Q2,62403.68,Gerald Johnson,HR,In Progress
Absent,50,2860.04,2025-04-01,Christopher Anderson,xmorgan@brown-perez.com,Other,Mid,December,Lori Hunt,About measure choice start financial oil daughter need avoid huge rate color.,1,London,Q4,115738.26,Juan Wang,Development,Pending
Absent,24,3873.04,2025-03-12,Andrea Velasquez,marcograves@fields.info,Male,Senior,December,Diane Ponce,Artist year defense democratic lose live behavior station.,5,Mumbai,Q1,62161.82,Brianna Fuller,HR,In Progress
Absent,78,1705.44,2025-01-26,Kristen Hicks,thompsonnatalie@hansen.com,Other,Junior,August,Ryan Martinez,Because apply study father far play baby dark move soon herself name out.,10,Sydney,Q2,72234.77,Cameron Frost,Sales,Pending
Absent,43,2927.12,2025-03-23,Jeffrey Stewart,wjones@hanson-bridges.com,Other,Senior,February,Jessica Rodriguez,Marriage until where manage room newspaper them.,4,Tokyo,Q3,75882.36,Joseph Adams,Support,Completed
Absent,7,3185.58,2025-01-20,Jennifer Ortiz,vtaylor@craig.com,Male,Mid,May,Misty Mullins,Open husband rather month candidate determine always never so.,6,Tokyo,Q4,92389.59,Sean Jones,Sales,Pending
Absent,14,2620.14,2025-01-27,Lauren Williams,kzimmerman@gmail.com,Male,Junior,April,Miguel Adams,Whole fill risk just three enjoy.,1,London,Q4,100353.4,Jennifer Russell,Sales,Pending
Absent,69,4907.97,2025-03-07,Sarah Montgomery DVM,qbaldwin@yahoo.com,Other,Mid,May,Joseph Alvarez,Recently present suddenly career station trip.,6,London,Q4,52733.95,Bill Watson,Support,Completed
Present,61,1293.2,2025-01-18,Tara Foster,crystal57@gmail.com,Other,Mid,February,Tara Reed,Own training science sell glass sing eat forward card.,1,Mumbai,Q4,107051.3,Kelly Bender,HR,Completed
Absent,18,1413.23,2025-04-10,Erica Brown,powellgail@hotmail.com,Male,Junior,April,Gabriela Marshall,Create fear whole tonight song summer sea.,8,New York,Q3,60564.9,Whitney Gutierrez,Sales,Completed
Present,58,4959.27,2025-04-07,Timothy Johnston,kimberly42@yahoo.com,Male,Junior,January,Kimberly Baker,Guess could lead entire happy government radio official happen federal.,4,London,Q1,110484.62,Taylor Lozano,Marketing,Completed
Present,98,4282.47,2025-02-08,Andrea Black,chad82@hotmail.com,Other,Junior,August,Jason Freeman,Tough stop site page environmental debate wife letter pick.,6,New York,Q2,60419.18,Thomas Suarez,Marketing,Pending
Absent,76,3520.73,2025-03-12,Clinton Cline,bishopmichael@yahoo.com,Male,Senior,November,Tyler Clarke,Clear industry still arrive condition seven majority.,1,Mumbai,Q2,39117.95,Joshua Parker,Support,Pending
Absent,71,4153.86,2025-03-21,Christopher Olson,garciajames@cantrell-schwartz.com,Other,Mid,August,Eddie Smith,Mention degree couple off require bill fund.,3,Mumbai,Q4,62389.72,Daniel Figueroa,Marketing,In Progress
Present,30,4924.39,2025-05-10,Katherine Garcia,derek86@yahoo.com,Other,Senior,June,Paul Shea,Improve treatment up fish follow interesting mother religious onto relationship return capital sing.,7,Mumbai,Q3,92287.35,Christopher James,Support,In Progress
Absent,23,2382.21,2025-03-23,Lisa Sanchez,davidadams@townsend-mendoza.com,Female,Mid,June,Stephanie Hudson,Determine suffer seat small same under provide consider travel turn western hard until.,5,Sydney,Q3,116421.22,Anthony Jackson,Development,In Progress
Absent,24,1124.73,2025-03-01,Eric Rogers,morrissharon@kim.com,Male,Mid,August,Michael Jackson,Include important leave if every bit require eye hard nothing official.,7,Mumbai,Q2,81605.6,Mrs. Kathryn Miller DVM,Marketing,In Progress
Absent,89,1699.08,2025-05-03,Noah Perez,rgreen@robles.net,Female,Lead,February,Robert Byrd,Exactly arrive clearly general yard only.,4,New York,Q3,99634.89,Julie Holt,Support,Pending
Present,8,2905.04,2025-01-18,Jessica Sandoval,imartinez@moore-gonzalez.net,Male,Lead,July,Kayla Ruiz,Seek hope ball leave chance send fall itself off central cell level court.,7,Sydney,Q4,116179.58,Nicole Barnes,Sales,Pending
Present,100,4401.26,2025-03-02,Robert Glover,taylorsean@hotmail.com,Female,Lead,March,Mark Powers,Happy beyond evening seat build able follow line win Republican minute.,9,London,Q1,90072.71,Juan Garcia,HR,Pending
