Absent,30,3039.39,2025-04-01,Paula Robbins,alvaradohannah@hotmail.com,Female,Lead,December,Dr. Cody Wright,Hard month leg bit onto fill available agency likely expect.,9,New York,Q2,66223.39,Keith Cruz,Marketing,Completed
Absent,71,2258.78,2025-01-30,Thomas Mclean,jasonbeard@miles.info,Female,Senior,September,Melanie Hansen,Record seem culture some word as environmental large live wide morning environmental involve.,7,New York,Q2,104162.27,Karen Greene,Marketing,Completed
Present,56,2600.02,2025-03-30,Kathleen Fisher,crystalpowell@gmail.com,Male,Lead,June,Dustin Martinez,Debate involve anything shoulder national later.,2,London,Q2,91073.29,Tanya Rangel,Development,Completed
Present,42,3626.8,2025-01-04,Justin Morales,schaefervictor@yahoo.com,Female,Junior,July,Steven Dawson,Large baby prove condition health audience pretty.,6,London,Q4,103910.1,Robert Valdez,Marketing,Pending
Present,92,3289.79,2025-03-18,John Turner,kennedyjose@yahoo.com,Other,Junior,November,Larry Jones,Suggest strategy world whatever focus environment glass this language dream parent.,5,New York,Q3,106405.86,Andrea Garrett,Support,Completed
Absent,68,2091.11,2025-03-05,Julie Little,hensleybrad@riley.com,Male,Junior,October,Mrs. Shelby Pearson DDS,Civil near deep subject analysis same sport music represent.,10,Mumbai,Q3,84687.3,Caroline Arnold,Sales,Completed
Absent,87,4190.7,2025-03-13,Taylor West,jacob18@gmail.com,Male,Mid,September,Cheryl Shepherd,Finish say control compare us down sure.,4,Tokyo,Q1,94928.94,Timothy Martinez,Sales,In Progress
Present,30,1660.71,2025-01-18,Christian Bowers,fnewton@hanson-davis.org,Male,Junior,July,Benjamin Ballard,Require when yourself performance organization population keep possible high ground most improve institution.,9,London,Q2,86417.63,Justin Allen,Support,In Progress
Present,59,3853.55,2025-04-27,Melissa Walker,qmartinez@yahoo.com,Female,Junior,April,Stephanie Taylor,According dream here eye environment few stuff.,3,Sydney,Q1,104347.9,Christopher Ballard,Marketing,Completed
Absent,66,3757.49,2025-03-02,Tricia Garcia,hcarter@yahoo.com,Other,Junior,July,Justin Nelson,Level current step without result third give type list great even care.,7,Sydney,Q1,32782.87,Tracy Ford,Support,In Progress
Present,91,1170.75,2025-03-05,William Vasquez,zpugh@moore.com,Other,Lead,May,Ruth Johnson,Degree article office computer fish wrong.,8,Sydney,Q1,53237.1,James Gonzales,Development,Completed
Present,59,2489.42,2025-05-08,Kevin White,phillip81@wilson.com,Female,Junior,October,Christina Morgan,Wonder discuss important other protect draw small power hand throw he light final share.,3,New York,Q2,65253.64,Mary Fuentes,Support,In Progress
Present,28,4919.5,2025-01-03,Troy Lee,heather74@smith.com,Female,Lead,February,Patrick Torres,Build security thing agreement fine very.,9,Sydney,Q4,105386.28,David Figueroa,Marketing,Completed
Present,82,4690.42,2025-02-27,Marvin Watson,teresarodriguez@hotmail.com,Other,Mid,March,Ryan Moreno,General marriage smile rest college other meet relationship cold.,4,New York,Q4,68477.1,Janice Cox,Marketing,Pending
Absent,4,3805.17,2025-01-22,Kyle Cook,ericbrown@hotmail.com,Female,Junior,December,Kyle Jackson,Marriage have billion energy to break purpose onto against fish Congress top say.,10,Sydney,Q3,56070.65,Karen Ramirez,Marketing,In Progress
Present,25,1810.21,2025-04-04,Kevin Hart,ashley29@hotmail.com,Other,Junior,June,David Luna,Reveal human wish do new life child start stage manager.,9,Tokyo,Q1,51108.55,Brittney Cooper,Development,Completed
Present,78,1720.09,2025-02-25,Leslie Grant,jamesbrenda@arnold.com,Other,Lead,June,Michael Fletcher,Interview serious fight son light yet.,5,London,Q1,30308.5,Sara Smith,Support,In Progress
Present,54,2217.97,2025-03-24,Christina Tran,maria81@gmail.com,Female,Junior,July,Alan Wright,Old wrong key movie partner small bit wide hold through pass woman ago.,8,London,Q3,91529.24,Stacey Gonzalez,Development,Completed
Absent,8,4351.53,2025-01-21,Kimberly Kennedy,nancy99@robinson-gray.com,Male,Lead,October,Michael Bell DVM,Term dark wall sport former debate.,9,Tokyo,Q3,43438.43,Tammy Wyatt,Development,Completed
Present,81,4227.45,2025-01-19,Nicole Haas,warrenjustin@yahoo.com,Female,Mid,December,Lisa Fox,Public several tell and last hand yeah above clear new weight particular call.,1,Mumbai,Q3,56599.13,Victoria Reese,Marketing,Completed
Absent,94,2207.69,2025-04-29,Christopher Baker,spencerthomas@yahoo.com,Male,Junior,July,Melanie Carr,Five citizen miss record military well manage talk opportunity campaign else security during.,6,London,Q2,85219.62,Matthew Stokes,HR,Completed
Present,95,4265.01,2025-04-13,Patricia Pena,salazarethan@gmail.com,Female,Mid,November,Jill Olson,Dinner to issue grow gas herself any pull person throughout leave.,8,New York,Q3,103001.38,Laurie Martinez,Development,Pending
Present,44,2582.65,2025-03-09,David Hubbard,eric32@yahoo.com,Other,Mid,March,Kelsey Harris,Middle until include few old shake manager.,9,Mumbai,Q4,101427.78,Steve Berger,Development,In Progress
Present,32,2156.85,2025-02-24,Vickie Clark,vgalloway@snow.com,Other,Junior,June,Tanner Gomez,Catch how believe daughter bar story reach.,4,Mumbai,Q4,92319.06,Austin Martin,Support,Pending
Present,93,3285.93,2025-04-05,Donna Williams,jennifer90@hotmail.com,Female,Senior,April,Monique Hardin,Fine yard center court research three three you successful.,10,Sydney,Q4,39617.88,John Watkins,HR,Completed
Present,99,4581.14,2025-03-04,Amanda Montes,austinjohnson@hotmail.com,Female,Lead,June,David Miller,Before religious thing enjoy yet pull rise per relate.,9,Sydney,Q2,103689.49,Jennifer Walsh,Marketing,In Progress
Present,69,2777.76,2025-01-10,George Chavez,christopher13@yahoo.com,Other,Junior,December,Adrienne Flores,Body hospital recently kind these various.,1,Tokyo,Q3,77412.42,Jade Phillips,Sales,Pending
Present,98,3492.69,2025-04-21,Rose Anderson,fsoto@alvarado.info,Other,Senior,June,Alexander Newton,Ready of free job career customer task.,5,London,Q4,100395.15,Patricia Martin,Marketing,Pending
Absent,16,2637.47,2025-01-26,Joseph Mitchell,edward00@yahoo.com,Male,Lead,May,James Cook,Table miss and yes long east movement.,4,Mumbai,Q4,48853.6,Joseph Gentry,HR,In Progress
Present,74,2678.37,2025-01-02,Brian Miller,vturner@gmail.com,Other,Mid,October,Kyle Donaldson,Customer structure model moment beat spend view science American adult worry fire.,6,Mumbai,Q1,36571.66,Kristina Robbins,Support,Completed
Absent,79,2420.18,2025-01-09,Stephen Schmidt,stoutgregory@yahoo.com,Female,Senior,June,Holly Mueller,Benefit green consumer clearly full food sit time student lay event.,4,Tokyo,Q1,88000.37,Stephanie Russo,Marketing,Pending
Absent,13,1074.39,2025-01-10,Keith Oneill,kylegarcia@benton.biz,Other,Mid,August,Jared Martinez,Box personal peace run he heart operation hold material fight effect.,2,Sydney,Q2,84586.68,Ronnie Stephens,HR,Pending
Absent,93,1859.71,2025-02-23,Troy Norris,wooddeanna@ortega.info,Female,Lead,August,Karen Carter,Hand help similar modern idea method career.,3,Sydney,Q4,107198.99,Julia Nelson,HR,Pending
Present,41,2650.1,2025-04-01,Erin Larsen,jessica33@yahoo.com,Female,Mid,May,Steven Richardson,Even range media serve far mention type history expect approach lay.,3,Mumbai,Q3,113404.01,David Cochran,Support,Completed
Present,65,2934.75,2025-03-18,Ashley Roberson,kramerkeith@gmail.com,Other,Lead,March,Jessica Cantu,House sport game after machine while federal water defense office.,4,Tokyo,Q2,31109.51,Kimberly Wilcox,Development,In Progress
Absent,0,2317.99,2025-04-09,Walter Cook,lauren01@stewart.info,Other,Lead,March,Kaitlyn Long MD,Force arrive physical your agency wait feel service.,8,Mumbai,Q2,102553.49,Garrett Lane Jr.,Sales,Pending
Absent,46,1998.3,2025-03-05,Anita Singh,harrisdennis@davies.com,Other,Lead,February,Maria Garza,Sit close hope truth prevent radio administration act team popular least add.,2,Mumbai,Q2,38764.52,Jordan Burns,Support,In Progress
Present,17,2319.03,2025-01-19,Kathleen Macias,rhale@gmail.com,Other,Mid,February,Paula Huffman,Hair author when hand finally pick Mrs way shoulder really.,8,London,Q2,40100.65,Melissa Martin,Sales,In Progress
Absent,48,1760.45,2025-02-10,Brian Green,vincentmcgrath@yahoo.com,Other,Mid,April,Angela Adams,White professor school floor red military situation want leg turn pull heavy.,5,Mumbai,Q4,61490.83,Stephanie Durham,Support,In Progress
Absent,66,3989.89,2025-02-18,Frank Thomas,karen06@mason.org,Male,Mid,January,Mrs. Stacey Hinton,Team remember effort every white test debate more seven between.,5,Mumbai,Q1,81899.48,Thomas Lewis,Sales,In Progress
Present,40,3281.45,2025-02-22,David Lewis,millervanessa@gmail.com,Male,Lead,June,Melissa Flynn,Specific skill produce model near above many each.,7,Tokyo,Q3,105015.49,Regina Short,Marketing,Pending
Absent,1,1817.61,2025-02-23,Brittany Chavez,wrodriguez@williams-scott.com,Male,Lead,November,Frederick Bauer,Great modern reality without reveal lawyer firm he figure difference study.,5,Mumbai,Q3,99270.57,Madison Ross,HR,Completed
Absent,35,2033.47,2025-02-17,Randy Frost,gklein@stewart-mitchell.net,Female,Lead,March,Christina Navarro,Reality coach one pass accept couple to.,9,London,Q3,82284.59,Tom Jones,Development,Completed
Absent,7,2424.36,2025-04-04,Michael Miller,riley00@wood.com,Other,Senior,May,Kelsey Murray,Grow enough season only rate interview north structure decade brother.,6,Sydney,Q4,57488.4,Grace Hale,Marketing,In Progress
Present,75,1197.18,2025-05-04,Brandon Lopez,kfoster@hotmail.com,Female,Senior,March,Nicholas Holder,Mission accept check process yes successful project its teacher author whether.,5,London,Q1,40465.19,Kristin Parks,HR,In Progress
Present,67,3156.74,2025-01-19,Timothy Cabrera,moralespatricia@gmail.com,Other,Lead,May,Grant Gray,Company discover wear others rule spring human.,1,New York,Q4,94311.08,Tonya Jones,HR,In Progress
Present,76,3860.06,2025-05-12,Taylor Franklin,joseph26@ewing-clark.info,Male,Senior,October,Angela Branch,That relate talk cost anyone floor international resource.,1,Sydney,Q1,62454.38,Christopher Johnson,Development,Completed
Present,26,1436.75,2025-04-01,William Everett,qlewis@ryan.com,Male,Mid,May,Jonathan Stewart,Result nor worry board member next politics blood.,1,Mumbai,Q4,46219.21,Cody Berry,Sales,In Progress
Absent,5,4708.7,2025-02-07,Robert Hernandez,brent63@gmail.com,Female,Mid,August,Jasmin Jackson,Might support morning child message want everybody stop statement during.,9,Tokyo,Q1,114906.76,Christopher Wright,Sales,In Progress
Absent,34,4150.35,2025-02-09,Meagan Young,nhenry@valdez.biz,Male,Junior,March,Johnathan Smith,Thing wear weight also language unit memory fact total hair someone.,3,New York,Q4,55957.32,Louis Rose,Marketing,In Progress
Absent,13,3470.21,2025-05-04,James Hall,moranshelby@thomas-morrison.com,Other,Mid,January,Andrew Beard,Eight main about unit natural view although increase call any.,9,London,Q2,73302.42,Logan Brown,Sales,Completed
Absent,26,4637.13,2025-01-03,David Garza,edward70@hotmail.com,Male,Lead,June,Melissa Cobb,Who then outside section cause spend science herself alone range level.,4,Mumbai,Q2,108998.1,Tina Guzman,Marketing,In Progress
Present,42,1395.27,2025-04-20,Kathryn Edwards,jennifergonzalez@gmail.com,Other,Senior,March,Anthony Lewis,Hard attention fly pick way know wall.,4,Sydney,Q4,101848.7,Ashley Zimmerman,Marketing,Pending
Present,50,3496.32,2025-04-20,Jason Vasquez,elizabethvaughn@gmail.com,Male,Senior,March,Paul Jordan,How appear through lawyer computer so forward relate.,3,New York,Q2,119587.1,Laurie Ferguson,HR,Pending
Present,70,4736.89,2025-01-04,Christine Crosby,joseph39@allen.net,Female,Mid,April,Richard Ward,Case current training bed find sport cost information gun reason.,9,Tokyo,Q1,47001.01,Austin Moreno,Development,Completed
Present,47,4524.41,2025-02-24,Kathleen Dixon,davismichael@benton-martinez.info,Male,Junior,May,Alexander Mcdaniel,Kitchen image decade skill I stock international prepare budget notice current modern religious.,1,Sydney,Q3,91463.2,Karen Moore,HR,Completed
Absent,27,3596.42,2025-02-28,Frank Padilla PhD,nicolecarter@harper.com,Female,Junior,September,Joseph Butler,Mr reflect page less current contain report threat both edge we.,9,London,Q1,103406.69,Stephanie Cruz,Development,Completed
Present,75,4359.99,2025-02-26,Valerie Blanchard,mcguirewillie@barber-shepard.info,Female,Lead,May,Robert Osborne,Concern available fight section page see deep middle.,9,Sydney,Q2,62390.22,Angela Patel,Development,Completed
Absent,52,4480.16,2025-01-01,Tonya Johnston,bmitchell@anderson-mcconnell.com,Male,Senior,September,Dylan Cook,Have clear seat something morning class suddenly travel process bring.,4,Sydney,Q4,60050.7,Chelsea Chambers,Support,Completed
Absent,100,3907.61,2025-03-18,Ashley Rogers,krausebenjamin@hotmail.com,Male,Lead,September,Vincent Smith,Stand feel parent test news create majority voice property try.,10,Sydney,Q3,65290.26,Mark Cruz,Development,Pending
Present,1,3025.55,2025-03-29,Joel Johnson,joneswendy@conner.com,Female,Senior,June,Derrick Kane,Pressure general work into place hotel.,7,Mumbai,Q4,48575.73,Ashley White,Marketing,Pending
Present,79,3273.66,2025-02-15,Anthony Wilkinson,thomassandoval@hotmail.com,Male,Mid,January,Anna Oconnell,Positive body doctor paper task even statement.,4,Sydney,Q2,51222.91,Amanda Sexton,Development,Completed
Present,5,3330.6,2025-04-21,Jason Barnes,wilsonemily@gmail.com,Female,Senior,June,Daniel Hernandez,Than leader bit size investment within no there exist set.,1,London,Q2,73932.97,Kaitlyn Diaz,Support,Completed
Present,23,2982.36,2025-02-26,Paul Olson,nguyenmatthew@stewart-bishop.net,Male,Senior,May,Sharon Trevino,Require really sit suggest reveal structure language growth community red.,8,London,Q4,112023.73,Miguel Robbins,Marketing,Pending
Absent,45,3954.33,2025-01-07,Brandi Mccarthy,eduardo37@yahoo.com,Female,Lead,August,Elizabeth Soto,Theory increase any tough miss deal recognize modern type.,5,New York,Q1,41517.51,Yesenia Smith,Development,Completed
Present,54,4089.53,2025-03-27,Donna Russell,dawn78@yahoo.com,Female,Senior,September,Gina Benjamin,Per own each see campaign capital million.,2,Sydney,Q1,83859.94,Daniel Garcia,Development,Completed
Absent,65,1136.1,2025-01-19,William French,rebeccacarroll@wilson.info,Male,Senior,December,Renee Copeland,Worker because drug heavy process nearly try those long weight smile TV people.,3,New York,Q2,100538.66,John Fritz,Marketing,Completed
Present,66,3510.63,2025-02-23,Kathy Johnson,bryantstuart@gonzales.org,Other,Lead,May,Willie Cordova,Every politics financial green environment interest blood theory indicate.,8,Tokyo,Q1,80285.33,Michelle Kelley DDS,Development,Completed
Present,55,4038.97,2025-04-08,Scott Garcia,jonathanortiz@hotmail.com,Female,Junior,February,Adrian Sampson,Plant cold to member make on choose citizen find read.,6,New York,Q3,100644.79,Shelby White,HR,Completed
Absent,15,3535.41,2025-03-30,Deanna Clements,brandyharmon@hotmail.com,Male,Mid,September,Michael Thornton,Against much brother rule exactly administration page edge few.,9,New York,Q4,115328.29,Dr. Randy Murray,HR,In Progress
Absent,83,4153.32,2025-04-19,Sonya Haney,alan66@yahoo.com,Male,Senior,March,Mitchell Church,Specific item say school ok community role fact heart career letter choose.,8,London,Q2,53523.92,Jennifer Stanley,Marketing,Pending
Absent,91,1201.42,2025-03-26,Patrick Jackson,davissonya@gmail.com,Male,Mid,May,Keith Mclaughlin,Administration effect again ahead beyond though seem section according paper word.,5,Mumbai,Q1,44884.58,Ian Jackson,Sales,In Progress
Present,50,3053.71,2025-05-08,Donna Maddox,griffinbrittany@hernandez.com,Female,Junior,March,Blake Larson,Teach technology where rather where scene it building end under live.,3,Mumbai,Q4,49784.34,Robin Miranda,Development,Pending
Present,42,1141.81,2025-02-24,Michael Griffin,miranda96@miller-wade.com,Female,Mid,October,Michael Jones,Enter end now way rate can chance product happy than.,7,London,Q3,64974.88,Jose Crane,Sales,In Progress
Present,13,4406.5,2025-05-02,Laura Jenkins,richard13@mcmahon.com,Other,Lead,March,Jordan Hendricks,Common staff I five structure base leader child light.,6,Tokyo,Q2,65079.08,Monique Scott,Marketing,In Progress
Absent,56,3221.99,2025-02-09,Claire Carr,paul38@hotmail.com,Male,Junior,June,Andre Becker,Apply read structure same prevent explain of beautiful source Mr than.,7,New York,Q2,32561.22,Jacqueline Williams,Support,In Progress
Present,6,4565.12,2025-04-12,Samuel Kane,andersonmichael@rivera-alvarado.info,Male,Senior,January,Benjamin Duffy,Coach tax begin data deep marriage could forget travel.,10,Mumbai,Q1,107834.03,Julie Hood,HR,Completed
Present,44,1212.05,2025-01-23,Francisco Benson,henryjessica@white-lewis.com,Other,Senior,June,Stacey Perez,Girl step several country wall almost.,3,Mumbai,Q1,90218.29,Jennifer Rodriguez,HR,Pending
Present,97,2530.08,2025-04-28,Lisa Graham,danielmarshall@torres.biz,Male,Lead,February,Elizabeth Molina,Care huge green billion he course scientist activity serve bed rather over.,6,Mumbai,Q3,80225.77,Justin Lewis,Development,In Progress
Present,24,4953.62,2025-01-05,Andrea Mcpherson,bryan00@hodge.info,Male,Lead,June,Maria Sanchez,Head high grow finally do while because increase quite enjoy hard.,1,Mumbai,Q4,88184.54,Angela Mcknight,HR,Pending
Present,79,3649.2,2025-05-06,Keith Larson,baldwinheidi@yahoo.com,Other,Lead,July,James Clark,Such less win family law air bill voice shoulder structure fact shoulder sense.,9,London,Q4,106287.72,Randy Delacruz,Marketing,In Progress
Present,67,2535.52,2025-01-20,William Hood,drew49@gmail.com,Female,Lead,April,Ashley James,Protect want old middle data consumer eight between generation property standard.,8,London,Q1,91544.92,Kyle Edwards,Support,Completed
Absent,15,1489.93,2025-03-22,Anna Snyder,robertrusso@gmail.com,Other,Senior,October,Kristina Trevino,Control first simply establish factor age picture.,9,New York,Q4,107749.48,Ronald Pugh,HR,Pending
Present,31,2124.69,2025-02-15,Joe Espinoza,jamesbush@gmail.com,Female,Lead,February,Sandra Mclaughlin,Grow life painting old successful great agency account plan still trip close by.,4,London,Q4,71965.61,Michelle Jones,Marketing,In Progress
Absent,62,3651.64,2025-02-28,Anita Oconnell,anthonysolis@hotmail.com,Male,Lead,August,Jeremy Wolf,Hot environmental fly yard speech pass.,7,Sydney,Q3,35559.96,Mary Larson,Marketing,Pending
Present,38,3401.42,2025-03-19,Hunter Rodriguez,kennethhines@gmail.com,Male,Mid,September,Tanya Torres,Nation light crime father build item wide yet.,9,London,Q4,98743.27,Jeremy Myers,HR,Completed
Absent,28,3940.46,2025-05-10,Kathy Li,terrymegan@gmail.com,Other,Mid,December,Brittany Johnson,Travel common likely cover fine defense professional all moment but six town.,2,Tokyo,Q1,95072.63,Martin Watts,Development,In Progress
Absent,50,1543.93,2025-01-11,Miss Sherry Keller MD,vfarley@gmail.com,Male,Lead,January,Casey Stephens,Discover meet attack need she book student race good future.,8,New York,Q2,111029.94,Joshua Alexander,HR,Completed
Present,66,3170.75,2025-04-16,Ethan Barnes,mike01@yahoo.com,Other,Mid,January,Walter Barrett,Natural lay situation particular middle wide management mission onto.,8,Mumbai,Q4,55446.32,Maria Cooper,Support,Completed
Absent,59,1240.25,2025-01-25,Angel Jones,rogerskevin@gibson-allen.biz,Female,Junior,April,Catherine Frederick,Claim great just loss above purpose traditional.,7,Tokyo,Q2,30645.01,Michael Pena,Sales,Pending
Absent,68,1025.02,2025-03-14,Corey Fletcher,kathleen71@gmail.com,Female,Mid,April,Jeanne Andrews,Throughout improve event customer stuff above seek.,10,Sydney,Q3,66721.65,Michael Flores,Support,Completed
Absent,72,1009.11,2025-04-23,Stephen Hebert,ryangardner@smith-gomez.com,Male,Senior,May,Matthew Brown,They leader development catch of subject.,7,Tokyo,Q1,81644.37,Bryan Gross,Marketing,In Progress
Absent,26,1765.55,2025-05-11,Jeffrey Rivera,shall@medina.com,Male,Junior,August,Tiffany Bowers,Continue agency reflect another across spring bag community night recent.,4,New York,Q2,70457.58,Taylor Olson,Development,In Progress
Absent,24,4565.26,2025-02-05,Christopher Meyer,andreastewart@hotmail.com,Male,Mid,June,Rachel Cummings,Source energy exactly between international us open to month especially.,3,London,Q2,52434.45,Rebecca Baldwin,HR,In Progress
Present,9,2833.69,2025-02-02,Jordan Mcdowell,williamsamanda@yahoo.com,Other,Mid,May,Hannah Roberson,View kitchen lawyer choice although rate read opportunity.,6,Sydney,Q1,72449.77,Stephen Edwards,Sales,In Progress
Present,89,2224.74,2025-05-07,Marissa Floyd,jenniferhart@johnson-craig.biz,Female,Junior,November,Sara Robles,Report thing work later play team character bad know.,5,New York,Q4,103916.65,Cynthia Garcia,Support,Completed
Absent,26,4046.93,2025-04-06,Amy Miller,helenwashington@vega.com,Other,Lead,January,Mrs. Ashley Travis,Trade alone several today provide establish.,8,Tokyo,Q4,92836.4,Kevin Bartlett,HR,Completed
Present,21,2917.41,2025-03-14,Ronald Crawford,fowlercourtney@gmail.com,Female,Mid,November,Amber Fuller,Loss statement specific sit guess too order treat.,9,Sydney,Q1,80663.51,Sarah Ortega,Support,Pending
Absent,81,4515.2,2025-05-10,Rachel Robertson,marissa44@gmail.com,Other,Senior,October,Joseph Johnson,If according product weight news man chair there yet leave evidence.,4,Mumbai,Q3,43233.54,Cindy Sawyer,HR,Pending
Absent,12,4185.73,2025-01-14,Christopher Wright,bellrobert@rodriguez.net,Male,Lead,June,Anthony Hicks,Goal present second smile best my.,2,Mumbai,Q1,60907.88,Brittney Smith,HR,In Progress
Absent,63,4180.15,2025-02-21,Olivia Colon,matthewwebb@hotmail.com,Other,Mid,October,Wendy Ellis,Majority yet now line although though myself rate news.,4,London,Q1,114961.82,Andrew Farmer,HR,Pending
Absent,100,1161.58,2025-03-19,Jennifer Odom,patricia66@weeks.com,Other,Senior,March,Donna Hughes,Many keep bring lead table glass at product part only rather do.,7,New York,Q4,87128.96,Logan Kelly,Development,Pending
Present,51,3893.87,2025-02-14,Warren Snow,bennettnatasha@anderson-ferrell.org,Other,Lead,January,Joseph Evans,Hospital discover first project happen local professor.,4,Tokyo,Q2,107446.82,Dr. Ryan Lewis,Sales,Pending
Present,82,1679.45,2025-03-24,Leslie Hill,burnsjames@wright-reyes.com,Female,Lead,July,Amber Hartman,Couple bar indeed sort enough personal choose player modern air indicate serious.,8,London,Q2,84658.59,Jennifer Roberts,Sales,Completed
Absent,24,4378.75,2025-04-29,Anthony Lee,rdavis@gmail.com,Other,Lead,March,John Foster,Both region material certain trip focus region including cause.,8,London,Q3,84122.72,Hannah Howard,HR,Completed
Present,72,4387.18,2025-05-11,Justin Jenkins,shellycastro@guerrero.biz,Female,Junior,August,Christopher Lewis,Together left bank challenge water firm about.,1,Sydney,Q3,77711.54,Suzanne Zamora,Sales,Completed
Absent,42,2732.18,2025-03-23,Thomas Allen,halladam@hotmail.com,Female,Junior,October,Emily Melendez,Ten better right relationship their letter idea book seat our catch second right.,6,Sydney,Q3,89674.31,Kimberly Young,HR,Completed
Absent,88,2969.79,2025-02-13,Heather Anderson,spearsrobert@hotmail.com,Male,Junior,October,Christopher Lopez,For group society deep individual once.,5,Tokyo,Q4,36065.3,Kimberly Ramirez,Marketing,Completed
Present,86,2772.67,2025-03-28,Stephanie Fox,mrogers@smith.com,Male,Mid,August,Mike Gibbs,Science agency public possible ahead order race compare million.,4,Mumbai,Q4,106021.12,Damon Stone,HR,Pending
Absent,93,1464.79,2025-03-18,Michelle Hughes,zmorgan@gould.biz,Female,Lead,February,Scott Davis,Loss final life might like far send.,7,Sydney,Q4,45784.58,Jeffrey Kramer,HR,In Progress
Present,36,2047.03,2025-03-26,Paula Costa,devin28@black.com,Female,Junior,February,Ronald Jackson,Church along total food court foot.,4,Mumbai,Q1,96714.92,Jennifer Larson,HR,Pending
Present,76,3485.57,2025-02-20,Wendy Brown,carolynpeterson@brown.com,Other,Mid,October,Benjamin Moore,Picture word record entire understand like role answer sure box field economy.,2,Tokyo,Q3,84983.68,Aaron Knight,Development,Completed
Present,97,1149.91,2025-04-08,Paul Bond,martineznancy@davis.com,Female,Senior,June,Kyle Clark,Movement PM policy build box drug they.,1,New York,Q2,106960.26,Robin Murray,Sales,Pending
Absent,6,4867.68,2025-01-02,Tina Garcia,melissadillon@hotmail.com,Other,Senior,November,Olivia Gregory,Enter wear specific discuss including upon write art religious address matter.,6,Sydney,Q1,73995.99,Stephanie Lewis,Marketing,Pending
Present,14,3458.07,2025-05-13,Terri Shaw,vavery@gmail.com,Male,Lead,October,Erica Reid,Effect study low authority share animal single current expert now who.,3,London,Q4,44952.65,Vincent Meza,Marketing,In Progress
Present,67,2734.37,2025-02-05,Andrea Rogers,dilloncameron@yahoo.com,Other,Junior,December,Charles Fernandez,Practice small environmental best concern me whose provide.,3,Tokyo,Q4,90684.05,Sergio Solomon,Sales,Completed
Present,56,1033.53,2025-04-08,Richard Gonzalez,tbaker@gmail.com,Female,Lead,July,Kristi Ramirez,Knowledge white trouble environmental study ever number live word expect new president.,3,New York,Q4,64529.14,Erica Santana,Development,Completed
Absent,6,3317.96,2025-03-07,Michael Blanchard,scottcollins@hotmail.com,Female,Junior,February,Michael Brock,Current fall police animal once side.,7,Mumbai,Q4,31306.25,James White,Development,Pending
Absent,92,2141.17,2025-02-20,Alicia Cochran,matthewmcdonald@hubbard.com,Male,Senior,January,Dawn Lynch,Despite deal until detail reason role tonight lot trip wait without keep whole.,8,Sydney,Q4,61492.53,Christopher Lopez,HR,In Progress
Present,93,4565.49,2025-04-16,Cameron Pollard,alvaradothomas@morales.com,Female,Mid,December,Ethan Johnson,Specific myself light capital power say.,7,Tokyo,Q3,87179.54,Catherine Brown,Marketing,Pending
