Absent,32,4814.35,2025-03-31,Rhonda Martin,millerroy@mcdaniel.com,Other,Lead,October,Christopher Hill,Father per trip cold character ago necessary will thus yard.,9,Sydney,Q3,65488.23,Nathan Cook,Development,Completed
Present,94,1689.77,2025-05-09,Sarah Torres,jeffreygarcia@ryan-horton.com,Male,Senior,June,Michael Wilson,Plant management hear financial national church thought film Republican which.,3,New York,Q4,69788.83,John Freeman,Sales,Completed
Present,16,4874.32,2025-04-13,Jerry Heath DVM,stephen47@baker-ward.net,Female,Lead,June,Tyler Williams,Onto explain art particular significant however so fall adult teacher response ready security.,2,New York,Q4,119821.21,Lisa Gutierrez,Sales,In Progress
Present,95,1934.51,2025-01-25,Christopher Mendoza DDS,harrischristopher@mason.com,Male,Lead,June,Kathryn Welch,Onto become training sense or site ground.,3,Tokyo,Q3,57382.32,Scott Castillo,Marketing,Completed
Absent,81,4782.15,2025-04-16,Sarah Williams,qwalker@white.biz,Female,Senior,September,Greg Powell,Painting why rest our land citizen suffer series save eye need crime wide.,5,New York,Q4,119558.14,Gabriel Quinn,Sales,Pending
Present,0,3502.43,2025-04-18,John Rogers,danderson@greer-rangel.com,Male,Junior,November,Stacey Cole,Join we medical response matter section certainly business reduce.,10,Mumbai,Q3,34576.11,Allison Hicks,Sales,Completed
Absent,38,3880.03,2025-05-02,Alexander Hall,nicolebaker@henry.info,Female,Mid,May,Linda Green,Too I practice me represent little.,8,Sydney,Q2,71534.6,Jared Peters,Sales,Pending
Present,75,4910.18,2025-01-15,Andrew Harris,sellersgary@cruz.org,Female,Mid,September,John Simmons,Population as just language kitchen light service.,6,New York,Q2,92639.96,David Bryan,Support,In Progress
Absent,64,2400.82,2025-03-15,Brandon Shelton,elaine43@evans-butler.org,Male,Junior,June,Clinton Serrano,Network my Republican hit base spend policy modern question charge make ever work.,4,Mumbai,Q1,71944.59,Tammy Ryan,Sales,In Progress
Absent,83,3299.45,2025-02-18,Dawn Mason,kevin32@yahoo.com,Male,Senior,April,Thomas Fitzpatrick,Section imagine partner professor partner bill student.,1,Tokyo,Q4,101442.09,Jessica Mitchell,Marketing,Completed
Present,53,2985.68,2025-03-23,Anne Alexander,gregory41@yahoo.com,Other,Senior,September,William Young,Edge owner continue onto nation reason such half top prepare involve hear.,4,New York,Q4,93454.16,Paul Gibbs,Support,Pending
Present,77,3069.45,2025-04-21,Crystal Chavez,samantha53@strickland.com,Female,Senior,December,Jason Thomas,Property individual out school table technology.,5,London,Q2,90076.07,Allen Foster,Sales,In Progress
Absent,11,1132.9,2025-02-21,Nathaniel Hansen,shannon13@yahoo.com,Other,Senior,January,Amy White,Government sea public leg resource commercial turn likely case.,7,Mumbai,Q1,39823.84,Sheila King,Marketing,In Progress
Present,100,1849.67,2025-03-19,Danny Crosby,josephflynn@yahoo.com,Other,Senior,September,Vincent Mcdonald,Do this soon support garden push word near lead image relate response account pay.,2,Mumbai,Q3,31147.49,Cody Williams,Support,Completed
Present,41,4735.81,2025-03-04,Katie Miller,james02@rodriguez.biz,Male,Senior,May,Tonya Nunez,Wife wait nearly candidate TV third capital ever measure.,9,London,Q3,79906.29,Carla Lee,Support,Pending
Present,56,1483.88,2025-03-05,Keith Singh,cooperlindsay@elliott-alvarez.com,Female,Junior,December,Vincent Wilson,Treat boy open simple office stuff same suffer central wait need guess system section.,2,Sydney,Q1,74494.18,Mrs. Amanda Mathis,Sales,Pending
Present,22,1433.49,2025-01-31,Marie Phillips,pmendoza@price-henderson.net,Male,Junior,January,Jessica Brown,Close probably them forward human hot.,10,New York,Q2,98974.99,Thomas Johnson,Sales,Completed
Absent,24,3086.03,2025-05-09,Brittany Griffin,elizabeth65@yahoo.com,Female,Mid,January,Wendy Wheeler,Bar her partner yourself but recently machine admit many.,2,Sydney,Q4,36571.42,Cody Chung,Development,Completed
Present,62,1646.91,2025-04-22,Mark Joyce,adamsheather@yahoo.com,Other,Mid,November,Jacob Spencer,Middle it direction process attack community less type.,8,New York,Q4,74598.21,Tammy Harper,Support,Pending
Present,39,1042.31,2025-02-12,Austin Ramirez,ericalexander@hotmail.com,Other,Junior,March,Noah Wong,Serve local agent later least day material whole size raise current young front.,2,Tokyo,Q3,32345.89,Mark Porter,Marketing,Completed
Absent,53,3442.57,2025-01-17,Keith Murphy,morenojenny@yahoo.com,Male,Mid,May,Michael Paul,Type stuff huge many loss large now out reduce consider though class time.,8,Mumbai,Q4,110528.41,Jenny Daniels,Development,In Progress
Present,0,2503.09,2025-01-11,Mary Newton,curtishiggins@campbell-love.com,Female,Junior,April,Barbara Hart,Staff almost medical about film clearly all develop win.,3,New York,Q4,47252.87,Edward Wright,HR,In Progress
Present,3,2052.89,2025-01-03,Jeffrey Gonzalez,josephwilliamson@stewart.org,Female,Junior,February,Robert Nelson,Student body series Mrs mother expect oil.,4,Tokyo,Q1,115678.49,Nicholas Petersen,Sales,In Progress
Present,22,3589.24,2025-04-19,Mike Campbell,harriswilliam@brown-young.com,Male,Senior,March,Kyle Sellers,Soldier remain local early wear fight various race PM standard sea himself.,7,Mumbai,Q1,86174.88,John Garcia,HR,Completed
Present,60,2034.99,2025-01-31,Jennifer Johnson,hughessuzanne@yahoo.com,Female,Senior,August,Joseph Lee Jr.,Condition watch answer black throughout material.,9,London,Q4,38982.01,Donald Alvarado,Support,Pending
Absent,37,4672.73,2025-05-04,Kelly Kennedy,stephaniehester@hamilton-pugh.org,Female,Junior,March,Christopher Hernandez,Consider right drive figure culture fast must pressure.,3,Mumbai,Q1,56561.5,Timothy Martin,Support,Pending
Absent,29,2747.06,2025-05-11,Leslie Howard,john22@thomas.net,Other,Mid,August,William Gonzalez,Individual dark mission trip notice compare physical in effort edge involve person.,6,New York,Q3,62574.76,Julie Thompson,Sales,Pending
Absent,93,2265.08,2025-03-17,Annette Gonzalez,matthew67@perry.com,Male,Junior,March,Sandra Ray,Maintain citizen level individual enough pick eight.,10,London,Q3,50944.21,Megan Clark,Marketing,In Progress
Present,88,3120.93,2025-02-08,Ann Klein,hawkinssarah@sanchez.com,Male,Mid,January,Jennifer Keller,Woman friend cell forward member require test into college blood pass start.,8,London,Q2,49954.47,Debbie Cruz,Development,Pending
Present,23,1477.38,2025-02-09,Angela Fields,teresa11@harrison.com,Female,Lead,February,Brian Ortiz,Analysis task ask size mean wide home business agreement trip idea produce add.,1,Tokyo,Q3,118119.43,Kevin Avery,Sales,Completed
Absent,25,4121.18,2025-02-22,Andrea Hogan,valdezamanda@alvarez-chambers.info,Female,Senior,August,Beth White,Care left pretty policy similar score process believe ability family thank.,4,New York,Q3,110091.87,John Santiago,Development,Completed
Absent,73,3713.14,2025-03-23,Albert Roberts,ronnie23@clark.net,Other,Mid,October,Todd Taylor,Democratic late audience guess those wear with exactly real north anyone main.,7,Tokyo,Q2,49064.13,Kimberly Bennett,Marketing,Completed
Present,3,3360.25,2025-03-27,Laura Ho,evansann@gmail.com,Female,Lead,December,Laura Reyes,Article attention receive view become current relationship receive apply.,3,Tokyo,Q3,80404.66,Kyle Taylor,Development,Completed
Present,5,4083.5,2025-02-05,Jason Maxwell,christian91@yahoo.com,Female,Lead,March,Julie Fernandez,In idea south when security Democrat son be.,7,Mumbai,Q1,93123.62,Richard Davis,Sales,Pending
Present,15,1046.88,2025-03-15,Michelle King,xgrant@wolfe-davis.com,Male,Lead,January,Joseph Bell,Answer production year whether risk manager figure.,9,Tokyo,Q3,67431.05,Matthew Huynh,HR,Completed
Absent,73,3557.99,2025-05-07,Benjamin Thomas,maddoxmelissa@hotmail.com,Male,Senior,December,Eric Wilson PhD,Fight little military authority order think memory stay gun allow.,10,New York,Q3,86366.75,Lisa Hudson,Marketing,Completed
Absent,10,2171.31,2025-02-14,Barbara Nichols,mpalmer@ochoa.com,Other,Mid,July,Lacey Young,I us agree them say last apply debate almost reality.,3,Sydney,Q3,34688.48,Catherine Monroe,Development,Completed
Absent,8,4347.91,2025-02-11,Kevin Jones,vincentanderson@walker.com,Male,Mid,February,Courtney Brown,Tell begin at section less animal certain require test.,7,Mumbai,Q2,86070.65,Jonathan Chandler,Support,In Progress
Present,87,2484.28,2025-03-03,David Bowers,blackmichael@ryan-clements.com,Other,Senior,May,Joshua Dunn,Goal nice push office series myself defense face.,10,Mumbai,Q1,118701.68,Carol Martinez,Development,Completed
Absent,95,1933.03,2025-03-22,Makayla Gonzalez,lmcgrath@rosario-baker.com,Male,Lead,November,Kristen Bryant,Sister in heavy girl similar thought hit medical total series order but.,10,London,Q3,91206.79,Matthew Richardson,Sales,Pending
Absent,13,1956.17,2025-04-12,Bruce Burns,johnny26@gmail.com,Other,Lead,June,Michael Shea,Computer way great edge great science seat.,7,London,Q2,57853.81,Scott Thomas,Marketing,In Progress
Absent,38,3405.46,2025-04-04,Sharon White,jonesangela@li.com,Male,Lead,May,Theresa Terry,Sign program once certain guess base time.,7,New York,Q1,68333.84,Paula Daniels,Development,Pending
Present,64,1632.92,2025-04-29,Andrew Lee,ocarter@yahoo.com,Other,Mid,December,Melvin Clark Jr.,Present since water recently war wonder clearly same half blood.,7,Sydney,Q2,85634.32,Diane Flores,Development,Pending
Absent,38,2751.92,2025-05-09,Linda Delgado,michael13@patrick.com,Male,Senior,October,Daniel Flores,Manager peace follow walk authority save president.,3,London,Q1,87385.05,Anita Patterson,Support,In Progress
Absent,20,2060.46,2025-03-17,Matthew Salinas,herreradavid@yahoo.com,Male,Lead,February,Nathan Vaughan,Look woman care participant or technology physical me management politics attack.,1,New York,Q4,54048.8,Nancy Glass,HR,Pending
Absent,91,4959.26,2025-03-16,Mrs. Jenny Spencer,wmccoy@tran.com,Female,Senior,October,Michaela Harmon,Team garden out increase to safe hospital first represent lose actually experience new.,1,Sydney,Q4,46845.41,Corey Levine,HR,Completed
Present,8,4266.47,2025-05-02,Justin Potts,patrickclayton@yahoo.com,Female,Senior,May,John Arias,Evidence until everything audience while risk really.,7,Tokyo,Q2,99560.29,Mrs. Virginia Frank,Marketing,In Progress
Present,10,2880.88,2025-04-22,Jack Lawrence,odavis@mccarthy.com,Other,Mid,December,Madison Ruiz,Enough hotel certain enjoy employee southern fall save who significant though.,8,New York,Q2,58607.42,Courtney Good,Marketing,Completed
Present,35,2393.11,2025-01-05,Derrick Green,frank22@yahoo.com,Male,Lead,June,Matthew White,At everybody late anything give read leave including believe and us.,4,London,Q3,108344.76,Mikayla Gross,Sales,In Progress
Absent,69,2932.09,2025-05-12,Carolyn Kelly,dnorman@stone.biz,Other,Junior,October,Charles Taylor,Official site any environment human society anything surface any site traditional although.,9,New York,Q3,34912.81,Kimberly Cunningham,HR,Completed
Absent,57,1097.15,2025-02-10,James Caldwell,michael98@dennis.com,Other,Lead,March,Edward Mccullough,Voice source buy heart suffer analysis best those several.,4,Sydney,Q1,47122.44,Donald Taylor,Support,Pending
Present,73,4870.97,2025-02-19,Abigail Watson,anthony77@yahoo.com,Male,Mid,November,Sarah Reyes,Example quickly month present PM determine table candidate attorney get ahead.,1,Mumbai,Q2,118846.76,Tony Hickman,Development,Completed
Absent,89,1700.84,2025-01-21,Lisa Jenkins,bbrown@guerrero.biz,Other,Mid,June,Leon Glass,Perform mention someone bank television property close choice.,10,Mumbai,Q2,116883.4,Michael Johnson,HR,In Progress
Present,48,1851.5,2025-03-28,Ryan Murphy,anthony53@hotmail.com,Female,Senior,June,Candace Baker,About your still budget same matter give lose take family security contain money.,6,New York,Q1,39918.28,Laura Huang,Sales,Completed
Present,1,3774.16,2025-04-04,Mary Smith,lthompson@parker.com,Female,Senior,September,Lauren Miranda,Seat also billion moment idea relationship.,8,London,Q3,39672.91,Anthony Garcia,HR,In Progress
Present,5,1339.1,2025-04-11,Mark Harris,brittany73@gmail.com,Female,Senior,August,Robert Osborne,Analysis performance change toward local hit whom gun reality.,2,Tokyo,Q4,61487.27,Fernando Haas,Marketing,In Progress
Absent,12,1291.58,2025-03-30,Derrick Hendrix,matthewcrosby@hotmail.com,Male,Senior,September,Bruce Hicks,Field public type catch go probably include five trouble system.,5,London,Q3,101477.45,Joshua Molina,Development,In Progress
Absent,56,3127.43,2025-04-26,Anita Harrington,casey71@gmail.com,Other,Junior,March,Kent Dorsey,Parent day use consider statement reflect all mother stand price close.,3,Tokyo,Q2,61400.14,Jason Duncan,Support,Completed
Present,23,2692.02,2025-04-07,Jason Vincent,stacy21@johnson.net,Male,Mid,April,Jessica Gould,West get boy scene impact daughter.,6,London,Q2,87576.27,James Yu,HR,In Progress
Absent,66,3587.56,2025-01-21,William Gibbs,stephen17@hotmail.com,Male,Junior,June,Sabrina Sherman,Else arm section service relate fly data media compare.,1,New York,Q4,85456.15,John Fowler,Sales,In Progress
Absent,8,1740.95,2025-01-16,Dustin Ramos,baileycampbell@yahoo.com,Female,Mid,September,Lynn Collins,Here political north effort lay skill natural.,7,New York,Q2,83419.69,Kevin Fields,HR,In Progress
Absent,17,2502.56,2025-01-30,Paul Turner,rachaelgallagher@smith.net,Other,Lead,April,Aaron Hines,Listen police floor rather space relate then personal memory.,6,New York,Q2,40610.36,Dawn Washington,Marketing,Completed
Absent,97,2356.16,2025-01-05,Amanda Powell,amberhess@hess-henry.biz,Male,Mid,September,Brittany Hendricks,Thousand item door compare serious determine minute adult box network future.,10,New York,Q3,30206.89,Lynn Hill,HR,Pending
Present,60,3264.85,2025-02-26,Anna Adams,ellischristy@yahoo.com,Other,Senior,September,Jason Bennett,Leg between concern artist he camera reality.,10,Sydney,Q1,62336.14,Margaret Potts,Sales,Pending
Present,67,4606.17,2025-01-12,Sheila Hunt,emiller@hotmail.com,Male,Lead,July,Amanda Shaw,Available describe character east finally believe building amount.,2,Tokyo,Q1,76687.72,William Clayton,Development,Completed
Absent,41,1163.37,2025-01-30,Jessica Smith,rodriguezlisa@yahoo.com,Other,Senior,June,Kathy Sawyer,Economy national on mother cultural draw add pull sister shoulder behind today.,5,Mumbai,Q2,53511.12,Mary Holmes,Support,Completed
Absent,80,3851.15,2025-02-02,Emma Rice,mhayes@harper-williams.info,Male,Mid,April,Jesse Gomez,Travel time line media live these garden itself style house often reduce.,6,New York,Q2,45108.42,Melissa Bailey,Sales,Pending
Present,78,3807.43,2025-02-15,Erin Anderson,andersonapril@hotmail.com,Male,Mid,October,Heather Ortega,Our site send material personal surface exactly federal goal nature prove value charge.,9,Sydney,Q3,87895.68,Paul Rodriguez,Marketing,In Progress
Absent,19,2600.06,2025-05-13,Jennifer Powell,melanielee@gmail.com,Female,Junior,May,Mark Garza,Network like pay end person police fund long list.,7,Mumbai,Q3,52126.54,Steven Newton,Marketing,In Progress
Present,28,3601.39,2025-05-11,Kenneth Perry,michaelhenderson@gmail.com,Other,Junior,May,Jasmine Dillon,Word tree challenge assume keep as.,2,New York,Q3,98355.78,Danielle Jordan,Support,In Progress
Absent,60,1683.04,2025-04-16,Angel Crawford,wrightsamuel@perkins.com,Other,Senior,March,Linda Stevens,Offer if fall son myself drop human himself world include everyone.,4,Sydney,Q4,116380.93,Matthew Duffy,Development,Completed
Present,39,3918.37,2025-01-07,Christina Garrison,heatherquinn@mitchell-roberts.info,Female,Mid,January,Travis King,President bring miss camera several turn true reduce ball produce either.,7,New York,Q3,45672.16,Michael Murray,Development,In Progress
Present,67,1818.73,2025-03-28,Dean Meyer,ronald43@melendez.biz,Male,Mid,August,Jose Pratt,Leave prevent meeting include air certain effect skill get support.,8,New York,Q2,64972.09,Jesse Harris,Marketing,Completed
Present,66,3283.99,2025-04-29,Jeremy Nguyen,grayashley@hotmail.com,Other,Lead,August,Dr. Christina Martinez MD,Reveal four rich health claim when top ready form sign contain.,7,New York,Q4,43246.93,Bryan Conner,Support,In Progress
Present,3,2412.11,2025-03-28,Mathew Ortiz,anthony70@hotmail.com,Other,Lead,April,Kelly Cabrera,Second street provide peace rich pretty writer help when us.,3,Tokyo,Q1,72628.86,Amy Bailey,Sales,In Progress
Absent,52,4519.52,2025-02-12,Jack Brooks,ctaylor@gmail.com,Female,Mid,April,Amber Graham,Spring nice heart effort still friend suggest.,7,Mumbai,Q2,39512.69,David Arnold,Support,Completed
Present,8,2091.68,2025-01-17,Sarah Harper,kristi76@phillips.net,Female,Junior,February,Tanya Bennett,Similar low together nor camera near run exactly standard mind grow country husband.,6,New York,Q4,101305.03,Austin Cervantes,HR,Completed
Present,89,2327.02,2025-05-02,Jean Clark,xroberts@hotmail.com,Other,Junior,May,Nicole Simmons,Get fall newspaper sound true data his.,6,Sydney,Q3,84812.86,Raymond Grant,HR,Completed
Absent,36,1519.29,2025-02-15,Jonathan Moore,kimricardo@gmail.com,Female,Junior,June,Jeremy Gamble,Group various case environment American reveal tonight machine pressure affect.,2,Sydney,Q1,94672.76,Joshua Brooks DDS,HR,Pending
Absent,62,2163.51,2025-03-26,Kari Livingston,wandahudson@yahoo.com,Male,Mid,June,Dr. Bryan Patterson III,Style name method foreign rule professor time I simple.,1,London,Q3,42006.26,Dustin Rivera,Support,Pending
Absent,0,4654.73,2025-04-07,Kevin Schaefer,jmccoy@clark-simmons.com,Female,Senior,June,Jill Lamb,If catch toward evidence yard during yet win visit financial.,3,Tokyo,Q2,90651.61,Jonathan Ellis,Support,In Progress
Absent,38,1574.37,2025-04-15,Fernando Wolf,jacksonkevin@baker-green.com,Female,Senior,February,Dr. Judith Dominguez,Stop within produce future huge agree mention.,6,New York,Q1,111809.48,Joshua Jackson,Support,Completed
Present,51,4550.91,2025-04-27,Adam Hunter,daviesbrian@kaufman-fisher.com,Other,Lead,July,Charles Long,Too economic owner meet address stage successful born.,9,London,Q4,90725.18,Christopher Johnson,Marketing,Pending
Present,98,3976.0,2025-01-31,David Hurley,amyhall@smith.org,Other,Junior,February,Michele Taylor,Increase behavior cause before music court never small scene.,3,New York,Q2,109050.44,Ashlee Powell,Marketing,In Progress
Absent,12,3274.25,2025-01-06,Jason May,jhaynes@fisher.info,Other,Lead,October,Jason Dominguez,Reflect enter drug list amount such bring health teach possible.,5,New York,Q3,45077.13,Pamela Sexton,Sales,Completed
Absent,3,3549.17,2025-03-01,Kevin Holt,gwilson@hotmail.com,Other,Mid,March,Leslie Johnson,Moment the military long policy anything watch bar maybe teach more.,7,London,Q1,83044.24,Robert Hernandez Jr.,Marketing,Pending
Present,42,2225.16,2025-01-29,Douglas Diaz,campbellbrandon@davis-tanner.info,Female,Senior,September,Kayla Faulkner,Most prove free ahead interview green say investment discover style all agree degree.,9,London,Q4,87165.71,Beverly Dalton,Sales,In Progress
Present,52,1569.75,2025-04-02,Lance Bridges,ddavenport@stanley.com,Other,Senior,May,Michael Daniel,Provide major speak parent receive test cut life myself player trade resource trouble.,6,New York,Q1,44510.5,Scott Hughes,Marketing,Pending
Absent,20,3083.87,2025-05-11,Donna Richard,mejiapatrick@yahoo.com,Female,Mid,February,James Gross,Risk owner chance shake risk last appear four.,10,Sydney,Q1,118054.06,Jennifer Le,Marketing,In Progress
Absent,79,3819.4,2025-03-03,Tanya Hernandez,omar64@yahoo.com,Male,Mid,April,Marcus Hernandez,Industry determine manager baby onto find.,2,Tokyo,Q3,84186.75,Isabel Hancock,Marketing,In Progress
Present,48,1831.19,2025-03-27,Patrick Bennett,richarddavis@gmail.com,Female,Mid,August,Terry Morales,Son future thus structure feel guess must woman debate visit yard today wall.,9,Mumbai,Q4,36146.73,Rebecca Smith,HR,In Progress
Present,29,4444.64,2025-03-13,Stacey Reed,matthew64@hotmail.com,Male,Junior,July,Mr. Christopher Smith,White condition baby line hold each south party.,9,New York,Q1,91188.29,Lance Mcconnell,Marketing,In Progress
Absent,46,3541.28,2025-01-03,Jillian Schultz,rhill@francis-johnson.biz,Male,Lead,May,Holly George,Treat make service enjoy prove daughter mother agreement myself senior machine.,7,Sydney,Q1,102416.66,Candace Dunlap,Support,Completed
Present,48,3329.17,2025-03-13,Susan Wilson,sandra88@hopkins.com,Female,Mid,April,Sharon Norris,Several exist while near character deal arrive early choose century.,2,New York,Q2,109371.05,Justin Watson,Marketing,In Progress
Absent,89,3782.07,2025-04-17,Justin Price,brownjonathan@hotmail.com,Female,Senior,April,Veronica Norris,Information spend like whose think there history treat.,1,Mumbai,Q3,92822.99,Karen Lee,Marketing,In Progress
Present,60,4716.53,2025-03-09,Brooke Frazier,dhebert@yahoo.com,Other,Junior,July,Kayla Reynolds,Ask goal reality beyond wish life exactly head wife poor value understand back suddenly.,2,New York,Q1,57260.93,Alexandra Fowler,HR,Completed
Present,38,1940.19,2025-03-25,Erin Riddle,bryantstacy@fletcher.com,Male,Junior,May,Jennifer Houston,Middle fire than control open idea ahead image bad quickly respond summer anyone.,6,London,Q2,36834.16,Jose Lewis,Marketing,In Progress
Present,69,4399.92,2025-04-12,Nathan Ayala,joshuafranklin@yahoo.com,Female,Junior,October,Megan Wallace,Then big enough sort season figure number simple find security.,5,New York,Q2,98475.86,Rhonda Smith,Development,Pending
Present,70,2811.78,2025-01-26,Angela Morton,angela30@yahoo.com,Other,Mid,September,Amanda Jackson,Value field I believe best rate pick across these above sister which.,5,London,Q1,119918.83,Gina Jacobson,Marketing,In Progress
Present,40,2353.83,2025-01-04,Tracy Obrien,jason06@jones-singleton.com,Male,Senior,August,Timothy Williams,Meet stay political as suggest whose article tough soon final ok thought everybody.,9,Mumbai,Q3,35925.69,Christopher Rivera,Sales,Completed
Absent,31,3872.61,2025-05-09,Jodi Ramirez,qgallagher@gmail.com,Male,Junior,July,Sean Kennedy,Drop must class get focus offer thank less.,3,Sydney,Q3,99369.06,Alicia Thompson,Sales,Completed
Absent,24,2805.87,2025-03-31,Robert Pittman,roberthernandez@yahoo.com,Male,Lead,July,Carlos Watson,Reveal third number according quite big country occur.,5,New York,Q1,35178.18,Crystal Wheeler,Sales,Completed
Present,0,4230.28,2025-04-05,Lisa Clark,sara10@hotmail.com,Other,Mid,April,Kevin Torres,None position send never reality while career.,1,New York,Q1,89074.42,Jonathan Norman,Development,Completed
Present,72,2630.38,2025-01-23,Nicole Yates,anthonyferguson@oconnor.com,Female,Lead,June,Richard Edwards,Too instead foreign sense window often particularly study to follow three boy concern.,10,Tokyo,Q3,87331.91,Kevin Cook,Marketing,Pending
Present,12,3911.54,2025-03-23,Joseph Tate,velasquezmckenzie@myers.net,Female,Lead,March,Jacqueline Daniels,Determine per fine age sea cold beautiful often always realize.,1,Tokyo,Q4,93366.68,Brandi Malone,Development,In Progress
Present,3,2978.53,2025-03-19,Dave Pollard,george93@gallagher-mcdonald.com,Male,Senior,May,Christopher Fitzgerald,Whatever than friend loss sense police hard hotel score bill think really.,3,Sydney,Q2,88141.69,Veronica Elliott,Marketing,Pending
Absent,5,2396.48,2025-02-19,Adam Gardner,chavezlouis@brown.net,Other,Mid,September,Jonathan Bass,Responsibility house team pattern animal agent but debate.,7,Mumbai,Q1,49187.85,Mr. Ricky Boyd,HR,In Progress
Present,27,1044.33,2025-01-21,William Brown,jacksonpittman@gmail.com,Female,Senior,June,Brian Mitchell,Toward sort likely watch officer night success perform.,8,Tokyo,Q2,51226.79,Anthony Randall,Development,Completed
Present,94,4067.2,2025-02-15,Amber Baker,olarson@cortez.com,Male,Senior,April,Timothy Ramirez,Wear final when add although billion.,3,London,Q4,70545.05,Rachel Davis,HR,In Progress
Absent,73,3472.3,2025-02-03,Todd Hansen,beckybarr@mejia.org,Female,Senior,September,Kelly Hernandez,Just tough find woman appear improve expert write.,2,New York,Q4,61785.91,Michael Taylor,HR,Pending
Present,98,4873.7,2025-03-05,Mario Armstrong,yesenia33@smith-carter.info,Male,Junior,November,Robert Mcclain,Leader management occur often computer listen data remain make understand prepare.,10,New York,Q4,75724.9,Stacy Maynard,Support,Pending
Present,91,2769.7,2025-02-23,Christina Wyatt,paul18@parker.com,Female,Mid,October,Caitlin Yu,Everyone know situation population actually culture none federal house vote cut never professional.,6,New York,Q2,93957.53,Allison Frazier,Marketing,Pending
Present,4,1059.16,2025-05-12,Catherine Jacobs,tanya70@yahoo.com,Other,Lead,February,Mary Schaefer,Herself source myself him result television medical.,6,New York,Q4,63119.04,Melody Garrett,HR,In Progress
Present,9,4054.18,2025-05-04,Jason Allen,kleinjennifer@yahoo.com,Male,Lead,June,Laura Moreno,Star company record office throw artist would rule sit attention point score help.,10,Tokyo,Q1,35657.96,Jose Williams,Marketing,In Progress
Present,22,1502.08,2025-03-10,Larry Gonzalez,nathanoconnor@hotmail.com,Male,Mid,March,Chelsea Rose,Stage avoid suffer mission wait whom computer nothing science second compare life.,8,Sydney,Q4,107313.54,Paul Walton,Development,Completed
Present,54,4706.62,2025-03-24,Lorraine Allen,ncollins@hotmail.com,Other,Junior,November,Jordan Spencer,Suddenly you main party need according good miss media increase lose new.,10,New York,Q2,58848.43,Janice Fry,Marketing,In Progress
Present,74,2214.32,2025-05-07,Adrian Jones,gmann@henderson.com,Female,Junior,July,Donald Smith,Career deal mind his everyone happy kid sister.,4,New York,Q1,82886.65,Ashley Thomas,Marketing,Pending
Present,33,1418.17,2025-04-27,Steven Bautista,james19@yahoo.com,Female,Mid,September,Brittany Watson,Prove day wish woman style table then color education stand office heart.,9,Tokyo,Q4,81065.89,Kenneth Leonard,Support,In Progress
